part,script, 
3,"What about Dad??
Yeah, your dad. Hence the debt.
What the— Gerri? What the fuck is going on? Was he secretly funding the war in Afghanistan – and paying LeBron James to lead the fucking infantry?
’95, Logan needed cash badly for the studio acquisition. He took out a loan, through the family holding company—
Where it’s hidden from view?
The company’s private and he knew that, besides Frank, none of the other board members would see what was happening. And he added the loan to the company’s already considerable debt.
Okay. Okay, we can deal.
It’s secured against Waystar stock – and when the stock hits one-thirty we’ve breached the covenant and they can pursue repayment in full. Which, if they went through on, would eviscerate us.
But they won’t, they’ll renegotiate, right?
Well. That depends.
Uh-huh.
The banks know the man they invested in can no longer function. As far as they’re concerned you’re just some guy. With hair. So, it’s a question. Do they stick or twist?
You’re making it quite fucking hard to savor this moment, Gerri.
Hey.
Got a cigarette?
Sure. I know it’s a weird time. But I have some weed if you want to smoke a bone?
I’ve just been appointed head of one the biggest media companies in the world and I’ve also been in rehab for drug addiction and it’s possible my dad might die at any second – so excuse me if I don’t get stoned out of my gourd with you right now, cuz. . But a cigarette would be great.
Is he going to be okay?
I don’t know.
We had hoped to see a response by now. There’s hope. But if we don’t see one soon, that’s not promising. What we do know is: he’s stable. So, if you want to grab some sleep, this is a good time.
Night, Dad. See you soon.
Stay strong, Dad. Keep fighting.
Dad, I think I’ve finally worked out who I am and what I’m doing with my life. There’s a job I want. It’s called President of the United States.
Hi. Sorry, Marcia, it’s just everyone’s going home and I don’t know where to go?
I don’t know, Greg – a hotel?
Can you get me the Waystar stock price at close last night please?
How is he?
Good. A little clearer. He tried to put on a sock. —
Hey. Are you awake?
Mom. Obviously I’m awake.
Are you stoned?
No! Obviously I’m not stoned. I haven’t had breakfast, what kind of monster do you think I am?
And you’ve got ideas, in case they want ideas?
Mom, don’t micromanage!
I’m not micromanaging. Have they given you an advance?
It’s my first day! And you kind of are micromanaging, Mom. Okay? ‘To the moon and back, bumblebee’ to you too.
Okay! Just wanted to say goodbye.
Have you looked at the numbers? Poor Ken. He’s like dysentery for the stock price. You’re walking into a burning barn.
Just paying – homage. What’s that? You miss me? I miss you too! Maybe we should arrange a date when ‘she’s’ not around.
Weird.
You’re weird! Okay!
Tom, listen, will you come with me?
Ugh. I gotta stand firm on this one, baby. It’s a huge-y, first morning stepping up?
Tell them you went to see the big boss. Please? C’mon.
Arghhhhhh! Don’t make me choose! It’s a man’s right not to choose.
Thirty seconds?
I’m getting the kids ready. Malaya, can you get him his cup?
Yeah, this is dumb but – bank call this morning. And I just wanted to ask—
What bank – our old joint account?
Um, no, no, Rava!   bank. ICBC who’ve apparently bankrolled the old man for years— I said?
Oh yeah, sorry. I’m just in a rush.
Yeah. Two minutes. Do I play hard-on or softcock? What’s your read?
Ken. Talk to your people. Malaya, it’s good to let him pour it himself, thanks.
You’re just, you’re always smart – and just … hard-on or softcock?
Ken, can’t we do this later? But no one likes a softcock. Iver! No!
What’s he doing? Let me: Hello! Ive – listen to me, you need to be cool with your sister. Alright? Remember your strategies?
We have to go. I can’t do this now, Ken? Let’s eat something sometime, yeah? Okay? I’m sorry. Why don’t you ask Roman?
Roman? Rava? C’mon.
Out of ten?
A seven.
You’re in decent shape. Little sloppy. But I can get you tight as a drum.
Okay well, I trust Pax. Pax says you’re the best.
Pax is the best.
He’s a prick. But he knows the best places. He’s the only person I trust on food. So I thought, I should trust him on, like, the opposite of food.
Only thing I’m gonna say, Roman. I take my shit seriously, that’s why I have the reputation I do, so you got to be on board for this regime.
Dude, no need for the speech, I’m down.
Five-thirty, every day is the regime.
Serious as cancer. Seriouser. Fucking— money cancer. I gotta check out. I’m rolling COO now.
Uh-huh.
 Operating Officer. Waystar Royco. If it operates, I chief it. Five-thirty is perfect.
That’s a.m., yeah?
Sure. Cool. Because the other five-thirty I’ll be – being an agent of change and you know, sacking people.
How’s that now?
A six?
Bullshit. I can go four more?
Argh! I think you popped something.
Hahahah. Nope. Señor, you’re done! —
Ask her to wait there.
Hey ‘she’s’ here!
It’s just something that happens. The morphine—
I know. I’m fine.
Is everything okay?
Lovely to see you, Siobhan. Tom?
I’m afraid I can’t stay.
We will settle any outstanding fees and non-disclosure agreement with her.
Really? She’s good—
It’s best.

Nothing. Staff. So! Good to see you.
Likewise. Look, I know you said he wasn’t great, but I was passing and I just
Oh that’s sweet. He’s not seeing people right now.
Sure, but I just thought I’d pop up even if he’s grumpy—?
It’s best you don’t.
It’s okay, I’ll take the earbashing!
I’m afraid that’s out of the question.
Um. I mean, could you just see and check he hasn’t, changed his mind?
Of course. Let me go and ask.
Hi? Shiv. Logan’s daughter? Thanks so much for everything by the way.
That’s quite alright.
Yeah well, much appreciated.
And how does he seem today?
Oh. You know.
Yeah, we heard all about the sock?
It’ll stabilize.
I know. I know it will. So, I’ve been thinking and I’ve got a new strategy for the call?
Uh-huh?
Hey. Don’t look so fucking nervous. It’s making me nervous.
I’m relaxed! It’s just maybe a little late considering the gravity and the need to get the relationship right.
Absolutely. The new strategy is really just a refinement of all this great work— It goes— Well the working title is: ‘fuck you’.
Uh-huh?
Hi, I have Mr Polk.
Uh-huh. What do you think?
I think – I may need a little more explanation before—
My dad’s a bastard. They need to know I’m a bastard too. Right?
Right but—
Great. Hey, Mr Polk?
Hi. Kendall, good to connect.
Likewise. Great. So? You wanna go?
Er, sure, or why don’t you go?
Um, well, we just wanted to make contact, given where we are.
Uh-huh. We are concerned.
Absolutely. Now obviously, look, the main thing is we just handle this very calmly because the last thing either of us want is for this rather private arrangement my father made to cause waves?
Oh absolutely.
But I guess the issue is, we owe you three-point-two billion.
Three-point-two-five.
Hey, I was rounding down!
We round up.
Secured against Waystar stock which is undergoing some temporary turbulence due to sector-wide factors. So – I guess what I’d like to know is what your position will be if we have a sustained breach of the stock price and we fall out of compliance with our debt covenant?
Okay, well, if the stock drops, we’re entitled to ask for repayment in full.
Uh-huh. Exactly. Technically. So what – what will we do here in, reality?
If it breaches one-thirty, you’ve broken the covenant and we will want repayment.
Right – I know. But really?
Seriously.
I get it. That’s your starting position, but we will want to restructure, and—
Look, here’s where I’m at. We’re not crazy about the media sector, we’re not crazy about how your father has treated our relationship. And our position is to seek recoupment.
Oh come on, man, fuck off. Hello?
Hi.
Yeah? C’mon. Real world. Can we start to negotiate?
That’s our position. If the stock drops below one-thirty, you’re in breach and we want our money back.
Fine, well let’s keep talking—
If you need to talk to me maybe it’s better if we go through an intermediary. I’m not a particular fan of foul language and I don’t like to be insulted. Thank you. Good morning.

Uggghhhh.
Give me a level?
Fuuuuuuuuck! That was brutal.
You were listening in?
Of course I was in! I’m COO.
Are they for real. Would they squeeze us?
Well obviously they could.
But why would they? They won’t, will they?
Relax, bro. New trainer. It’ll be okay.
No it fucking necessarily won’t. If this became public. We could nosedive. We could death spiral here.
Fine, dude, I was only trying to be nice, that was a fucking shit show and you handled it like a moron is the truth.
Fuck off.
Fuck you.
It’s fine. Just— We need, next time, to have a more considered strategy. I’ve got a portfolio of options?
I have a pitch?
Sorry, bunch of calls. Shiv is trying to reach you?
Finally entering the Death Star!
I can’t fucking believe it. Can you? Fucking – where does she get off?
Just can’t help feeling this is a little like my mom’s taking me to my first day at Death Star school. Such a sexy little mommy.
Greg Hirsch? I’m, I ah … believe I’m working here, as of today?
Okay? Umm— I have no – record of that.
Well I’ve definitely got a job, so?
I’m sure. I just don’t – have anything?
Okay. Um? Then, what, should I just head on in and have a mooch about?
Um, no.
Okay. So, what do you suggest?
Well what is your job title and who appointed you?
Um, job— Not entirely sure per se. And I was actually personally appointed by Mr Logan Roy? Can we call Tom? Tom um—
Last name?
His last— Weird, don’t think I ever, Tom, Boss Tom—? He’s in a relationship with my cousin, Shiv, Roy? Who’s my cousin? I mean I think that’s public knowledge. Although. Maybe, if you could keep that under your hat? Tom? Tom? Hey!
Okay. Greg? Greg Roy?
I’m actually a Hirsch, not a Roy. But my mom was a Roy. So, I’m basically a Roy in all but name. As it were.  
I’ll be two minutes, thanks.
No. No, Shiv— What?
It’s got weird, okay? I was over there and it’s gotten very weird.
How is he?
I don’t know, he might have put on a sock.
Well that’s good, right?
Or he might be lying there dead, I have no idea.
I can’t do this now, Shiv.
She thinks Marcia’s poisoning him.
I do not. Apparently, he doesn’t want to see us.
What, not including me?
Why would he say that?
Still pissed at you for not signing up to his corporate restructure? To make Marcia queen of the castle?
Well maybe  . Look did   see him over the weekend?
I heard he wasn’t up to seeing people?
No one’s seen him since we moved him home from the hospital on like Thursday?
Rome – you saw him, right?
Sure. For like five minutes. He was – he was pretty – you know, it wasn’t really ‘him’, him. There were tubes.
But after that? No one apart from Marcia has seen him for the better part of a week.
Four days is not a week.
Okay for the majority of the week. And we’re just accepting, the world is just accepting, this woman’s word that he put on a fucking sock?
We don’t want to rush the recovery.
Right, cos you like playing boss? Ken, we need to know what’s going on. Will you go over and see, please?
Should we take twenty?
Shiv, this is— I literally have something unmissable. Later, I’ll try later, okay?
Okay. Everything okay?
No, we’re on the brink of total corporate collapse.
Uh-huh. That figures. Call me if we go Lehman will you? I might like some of these chairs.
Hi, morning. Here to help fix the Death Star. ‘Grill on the exhaust vent, guys, grill on the exhaust vent!’
I’ve got your back. I told them this won’t be a habit.
My only concern would be, to brief this – meeting – is it a little – aggressive – for a temporary CEO?
That’s a good point?
Yeah well we’ve got a very aggressive drop in our share price, so I think that’s appropriate, good? So brief this wide and brief it fast, okay?
Good.
Great.
Good. And then I’ll be doing the Vaulter shoot and we’ll hopefully crystalize a new vibe, right?
Morning morning morning! Hey hey hey. My people. How’s it going? Great to see you all. You know my brother and I, CEO and COO? Gerri and Karolina?
Hey. I’m going to stand. Back. New trainer.
So. Just wanted to get the group together early in my tenure to say: Yo. You’re probably all wondering about my dad. He’s doing okay.
Yowch— .
We’re hoping for a full recovery.
He’s like a thousand percent better though. He’s like a bull in rhino hide.
Uh-huh. Slow and steady.
This morning he put on a sock. So.
That’s right. This morning he tried to put on a sock. And welcome to Tom Wambsgans who was managing resorts and is now sitting up with the grown-ups.
Hey—
So – what I want to discuss with you all this morning, is a new strategic vision. We have a great firm here. Multifaceted. Parks, cruises, et cetera. But at the heart, media: TV, movies, books and newspapers. And what we’re fighting for is eyeballs. Eyeballs we sell to, eyeballs we crate up and auction to advertizers. And bottom line: we’re losing. To monopolistic disruptors: Alphabet, Facebook.
Internet. Fucking game-changer, baby.
But we are still, just –   in a position to leverage our brands into something in the new landscape. But if we don’t, we’re gonna be like the biggest fucking horse trader in Detroit, 1909, okay? We need a more dynamic strategy – let’s call it, for the sake of clarity, the Strategy of a Thousand Lifeboats. Vaulter is a lifeboat. ATN Citizens is a lifeboat. There are no bad lifeboats.
VR could be a lifeboat?
VR’s a bubble. But yeah, no bad ideas.
Porn could be a lifeboat?
Except that. That’s a bad lifeboat. Hey – thanks, Rome. Look, this isn’t a brainstorm, all I’m saying: Everyone’s invited. I want all of you to be innovating, challenging, and bringing me a hundred lifeboats. Be bold, be disruptive! Okay? Because steady as she goes hits the iceberg?
Okay! Thanks, everybody! Woot woot!
He’s through there.
Hey Daniel. I understand you wanted to talk to me direct?
Yeah. It’s difficult with Joyce right now, so I thought this might be better.
Well, let’s get right to it, shall we? What happened? What do we say?
Okay, so I’ve been speaking to a friend who’s a lawyer and I’ve spoken to the PR people, at my publishers and I’m currently taking the view that I don’t want to comment as regards to anything.
Uh-huh. Fine. But between us, I don’t have time for a lot of – tofu. Was it your asshole online, were you looking to fuck around, what’s going on?
I’ve been advised not to say anything publicly.
Yeah but we’re not public and if this hack leaks Joyce is going to get fucked at a thousand miles an hour from every direction, so I need the facts?
The facts are – complicated and I can’t go into them right now. Everything isn’t as it seems. Is all I can say.
‘Everything isn’t as it seems’? That’s what I’m building my house on? What is that, your fucking Vegas magic show?
That’s it, for now, in terms of what I can say.
Okay well that’s a huge waste of my time, and I can’t speak for your wife but that’s a fucking treehouse of dildos right at the heart of this operation, so thanks a million and goodnight.
How’s your father? I was sorry to hear—
I have no fucking idea. Goodbye.
Great work, sir! Kudos! Here if you need a friendly ear, Lord Vader!
Just get shit moving at parks yeah, Tom? It’s stagnant. Shake that fucking tree, C3PO?
Shaking, bro! Shaking it big time!
Fiona— can you send flowers to Rava? Nice but, y’know, not ridiculous. They should smell like flowers, not desperation. And Fi, talk to Jess – I might want to throw a couple of items up on the internal – not a big deal, coupla TED Talks. And a documentary on the . First story. Because what are we, if not storytellers?
Hey, Captain.
Hey. And let’s get Carlo up in here. Those kitchens are a disaster. And maybe something fun. Not ping pong, but something, y’know. Throw some tags up in here. Not that. Skate park. Climb wall. None of these, right, but the essence? Talk to me.
Down three points.
Ugh. Okay.
There’s an AP headline: ‘CEO tells staff Waystar headed for iceberg’.
Not iceberg! Lifeboats! Lifeboats not iceberg. Jesus? Karolina?
That’s what we’re pushing.
The new regime shoot, Lawrence knows?
Yeah on that, ‘the new regime’? Forgive me for whoring in but shouldn’t I be in there as well?
Let’s not muddy it.
And in that equation, I’m the mud?
Okay, look I want to talk options to you, okay? I’ve got some thoughts that we’ve shared with Logan—
Interesting? Ideas that Dad didn’t want. Sounds appealing. But no, thanks.
Ken, these are modeled and thought through and—
And rejected. Now if you’ll excuse me, I’m going for a walk, I need some perspective.
The thing about capitalism is, and I mean there are issues, but  . I mean this is a piece of shit chain on a stretch of nothing and this – this is like the most fucking delicious thing that anyone has ever tasted.
So, Stewy, listen, I could do with a read, from someone without a dog in the fight?
I wanted to ask you something too.
This is tight, this is absolutely just us okay? Because a leak kills me.
About Rava. For a pal.
Rava?
Yeah, it’s a mutual friend, and like, is it cool? Or are you still hankering for a wankering …  ?
I don’t have time for this – I mean, who, who’s asking? What?
I can’t say, but they wanted to know if it was an issue?
Like who? Fucking, Paul?
Fine, if you’re asking I’m assuming it is an issue.
Yeah well, look, we’re separated. Whatever. Free agents.
I get it. I’m having another. If you eat it fast enough you can actually burn off the calories. It’s a loophole.
So. When I took over, found out Dad took out a huge loan, a decade ago, secret, through the holding company?
Seriously?
Secured against the family’s stake in the public firm.
Oh fuck.
Yeah. Now the stock is getting ready to breach and the bank are—
Yeah I saw that price, brutal. Who’s the bank? Sounds like they have your dick strapped to the clapper of the opening bell.
I need a read.
Well, number one, you boost the price.
Uh-huh. Well I am trying. How’s it going to play for us to refinance elsewhere?
Honestly? Not great. ‘Why won’t your original bank step up?’ Not good. People don’t love the sector. They don’t love the firm, it’s ramshackle is the view, the fucking everything shop – and they don’t love— the situation. It’s tough.
Uh-huh.
Plus the options for sounding it out? Without word spreading? Horrible. Ugh. I’m so disgusting. One thing occurs, just blue-sky. Wouldn’t happen in a million years, but. What about we came in, my outfit, took the whole thing off the family’s hands?
Uh-huh? Well, obviously no, fuck off, how dare you, I’m so insulted, et cetera.
Of course. But you and Roman and Shiv. Do you all want to be in it, forever? You could all get fucking fucking, rich. Do anything. You can get into tech, Shiv can do consultancy,   Roman can, I don’t know, DJ for douchebags as they kill hookers in St Barts.
Uh-huh. Thanks. It’s Paul, right? Rava – it’s Paul?
Okay! I am open for business!
And can I get the senior team together tomorrow for a reorientation? I’m shaking the tree, folks! Excuse me, Greg, are you kidding?
Oh hey.
Greg, forgive me, but are we talking to each other on the poop deck of a majestic schooner? . No? Then why the fuck are you wearing a pair of deck shoes?
Oh, yeah? My credit card got maxed out? I’m living in a youth hostel
Jesus. How, squalid. Dude, are you carrying dogshit?
No, it’s – it’s free, right? Is that cool? I mean, I don’t want to be melodramatic but – my body is growing weak, due to – lack of sustenance.
But in a – dog-poop baggy?

Greg, that’s disgusting.
Not really. They don’t pre-poop them? They’re just bags, really. It’s just a mental barrier.
Pair of cap-toe Oxfords. Crockett & Jones. ASAP. Lucinda, can you figure out where we might put the talented Mr Greg? Flash! 
Can I get you to do a kind of a – a like an arm wrestle, on the top there?
So. How does it feel, man?
Feels pretty good.
Fastest falling stock on the exchange? One-three-four? Yeah?
Well, you know, I probably overpaid for you, so. Gonna hurt us.
I didn’t sign up for the toilet. I signed up for Logan Roy, major investment, global reach, not – Scrappy Doo and his thousand holey lifeboats.
Okay. Little cheesy? But ‘Vaulter’. How about, Kendall, would you like vault, like over Mr Yee here?
No.
No.
Fine. Okay. Then maybe just – bros? Hanging? Bros pose. Let’s go with the bros. ‘These are the bros who knows.’
I tell you what I wonder about you? Could you even open a restaurant? Could you actually fucking, do anything? Or are you just a name?
Good! How about another idea – ‘verbal gymnastics’? Can you give me a ‘business conversation pose’?
They got plenty. Make it work. Tell him to take thirty minutes’ worth of solo Lawrence shots and then delete them all.
Kendall. Sandy Furness is here.
What do you mean?
He’s here. In the building. In our offices.
The fuck? Who let him in?
Security wasn’t— And people were becoming aware … He’s been very nice to everyone.
He can’t do that. Fucking Pepsi doesn’t just drop in to see Coke. Put him where no one can see him. South Tank. I’ll be right there.
Sharks are circling.
How are we looking?
Down two more points.
Hey.
Hey. Nathaniel.
So. How’ve you been?
Busy.
Uh-huh. Right. So? Is this—?
It’s work.
Okay. Of course.
What?!
Fine. Just a simple work meeting on the bed of a four-star hotel room. If you don’t want a cookie, Shiv, don’t go down the cookie aisle?
It’s just private is all. The matter in hand.
Uh-huh, right? And, so how’s it going working with Joyce, the long glass of tepid water from Albany?
Good. How about you with that poor man’s Fidel Castro? The senior senator from the state of 1975.
Zing!
Look. I just wondered if you could do me a favor?
Do I owe you a favor?
Sure. Because I deigned to date you?
You  ?!
And I thought we were going to be friends?
Sure I want to be friends.
I wondered if you could run a background check on someone?
That seems like it might cause some ethical issues because there’s a world where my guy and your gal end up in the mud, wrestling for the democratic nomination and—
It’s not political.
Oh, right?
I need background on someone off the record. Marcia.
Marcia … the wicked stepmother?
Occurred to me a few years too late, I really don’t know much about her. Just due diligence. Okay?
Well, I do know a really horrible guy. And he’s incredibly expensive.
Well, thank you. That sounds perfect. Can it all go through you?
Uh-huh. ‘Yes my lady.’ ‘Deigned’? Have you  the women I dated after you?
Those women dated you   you dated me. It was like, ‘Oh I guess he must have   …’
Mr Furness! Kind of you to drop by.
Not at all. I just came to say how sorry I was to hear about your dad.
Really appreciate it. That’s kind.
I know we’ve had our battles but he was one of the great visionaries of his generation—
Well, it’s kind of you to do it in person when you could have just called, so. Thank you.
I hope I didn’t send the birds a-tweeting. What with all the uncertainty and whatnot.
We’ll make sure people know it’s just friendly.
Great. And will you give your dad my best? Tell him I dropped by?
Sure. Maybe when that news is a little less likely to kill him. Okay well I appreciate this, you’re looking great.
Thank you. I eat babies. And just to say, if I can give you any advice. I’m just watching the wheels nowadays so, you want to run anything by me, as an honest broker, use me. A mentor.
That is a very kind offer.
There’s probably a million options with our two firms? Swaps, acquisitions, cooperative interactions, smart stuff only a young man like you can conceive of.
Oh, Sandy, you’ve been pretty smart. Smarter than the regulators, anyway.
Tell you what was smart, Vaulter. I don’t care what the wise apples say.
Jess, would you take Mr Furness down.
Look at you. Right in the eye of the raging storm and cool as a cucumber. Stay strong. Stay in touch.
What happened?
He said I was dead in the water without him and tried to finger-bang me.
What did you say?
I told him I’d rather eat my own shit.
You heard?
What?
It’s over, bro. One-two-nine-point-eight. Clap hands, we’re fucked. I think if this was a movie, the office would now blow up.
You know sometimes you leave the party and you wonder what everyone’s saying about you?
With me it’s usually – ‘Who was that maniac who put a watermelon on his dick?’
I know. I know what they say about me. That. That’s how much people don’t trust me.
Hey, it’s me too, man. Don’t leave me out.
I mean the truth is – we, we call their bluff which may not be a bluff, and the debt becomes public and – we lose control. Or we get the stock up, which we – can’t, we can’t magic that. Or we pay the bank back. Which means – you know, to realize that much cash? Stock sell- down. Which is horrible. There are no good options.
Can I suggest something?
Uh-huh.
Can I suggest we all take our shirts off?
Umm? Ken?
You know I beat off in my office earlier?
You didn’t actually though?
You know, we can be a pair of little fucking worms wriggling around in here – do what the button-down fuckheads say. No offense, Gerri.
Please. Go ahead. Masturbate your way out of this.
Seriously, man. They could write an algorithm to run this place. But that’s not the answer. Break shit up. Disrupt. Yeah?
Ken? Tell him to put his shirt on.
I don’t fucking know. I don’t know. Okay. Look, so worst position, we sell down the stock. We survive.
Or. What about, next-wave shit. Prop-co op-co. Turn group finance into a profit centre?
Or go financial engineering. Full Enron?
Hey if you’re gonna shit on every idea, I got places I could be.
I mean to get some cash in the holding company – sell the old outdoor ads? And for the share price, parks and cruises?
Those are very profitable pieces of the jigsaw—
Poor Tom. Boo-hoo.
I mean sure but – what are we doing with them? Does that make a negative a positive?
Maybe we cut a title or two, from physical production. Newspaper- wise? Online only?
That’s a twenty-million solution to a billion-dollar problem.
But it’s the right direction of travel. That feels right.
Look, if you want stuff that will work for the price: lay-offs.
Yum yum, blood! See – shirt-off shit?
I guess it could be a package? Lay-offs, sell-offs.
Structured retreat?
Well, yeah, but with a philosophy?
I guess we should ask – or tell—
The sock-meister?
I mean we should at least  , right?
Could I just check – are these ironic at all?
Er, how do you mean?
I just— They look normal, but I’ve never— This isn’t my usual domain and I need them for normal so I just wanted to check, they aren’t ironical in any way or anything are they?
Hey, guys! Thank you so much for doing this here. I’m sorry. And – actually— can’t stay long.
Apparently goes for us too. Aunt Marcia won’t let us see Grandpa, right, kids?
Kendall!
Is he okay?
He’s improving. He’s really improving.
Great! Because I probably need to let him know something.
But he’s resting. I’m sorry. It’s not a good time.
Oh, okay – well, it’s just when my assistant called …  ?
She spoke with Joan, not me.
C’mon, kids.
Is this his request? The solitary confinement?
I’m absolutely guided by what he wants.
Well let him know, will you, I wanted to talk to him, keep him abreast of moves?
If you like you can tell me, and I’ll pass it on.
It’s complicated.
Oh. Of course. Over my head.
We’re – we’re retreating. Tactically, and—
I’m sure you’re doing the right thing.
She’s being protective.
Right. She probably has his brain in a jar and she’s working all night on his signature. For the new will. You get my flowers?
Tell Fiona, thank you.
Listen, how about you let the nanny take the kids.
Uh-huh …  ?
Come back to the old place and we probably need to—
Yeah—?
Y’know— negotiate.
You want to ‘negotiate’?
Yes. Like animals negotiate. Tough.
Have dinner with me? Tonight.
Hey buddy. Come on. First meeting with the senior management cadre.
Uh-huh? Great. Great stuff.
I’m gonna bad sheriff it, you cool to play the fuck-sock?
Uh-huh? As in? —
I was looking through employee emails, which by the way is completely legal, but does my breath smell? Honestly?
Er. No. No, I mean it smells of – breath but—
Too much drift in parks. Gotta shake that tree. I might punchbag you a little, that cool?
Oh sure. As in?
Morning, people. New day. Great to see you all. So, I’ve got a number of new approaches, that I’d like to run through. But first, some of you I know, some no, and I just want to get a feel for the team and let you get a feel for me? So, to kick off. Here’s a question. Here we are, off in the theme-park division, but tell me: If you could do anything, professionally, work anywhere, what would that be? — Yeah, go ahead. Can you intro?
Um, Brad Kilmartin, global marketing.
Hey Brad, good to meet you, man. So? Dream gig?
Um. I guess I’ve always wanted to work towards the creative sector in terms of— I could see myself, using my marketing skillset at a movie studio?
Sexy! I’m going to do you a favor, Brad. You’re fired. Follow the dream, man.
Heh. I mean—?
I’m sorry. This is the best division of the best company in the world. If you’re not happy, it’s probably best you move on. . If we aren’t feeling it, how can we get millions of American families to? Huh?
Are you serious? Jesus Christ?
So, now, you— Yeah ‘family man’? We all know why you’re here. You silver-spoon piece of shit?
Hey?
So, you bringing any ideas to the table or are you an empty fucking vessel?
Um – um. Ideas? Petting zoo?
Excuse me?
Like a scaled version, the biggest petting— It wouldn’t be pathetic,
Are you arguing from anecdotal? Because you better have numbers to back that up or I will tie your lanky limbs into a bow and turn you into a fuckable pretzel. Excuse me?
Okay, well, it’s hard. Well, I guess if Connor’s flying in?
He’s actually a pretty great guy.
So. Stewy. You know how everyone hates you?
Well, no. That’s not something I’m aware of, no.
Oh sure, they do. Private equity, getting your meat hooks in, chiseling your profit? Like a vampire locust fuck.
What is this? If I wanted to be insulted, I’d have coffee with my daughter.
I’ve had an idea. How about instead of taking us over, you give me four billion dollars? I stay boss. You stop raiding shitty companies for scraps. You  in a blue-chip corporation. One that is currently undervalued because of some unfounded concerns about its leadership, i.e. Little Lord Shareplunge here? The story twists. Happy ending.
Okay, full disclosure: I have a hangover. Bigger than normal. So, let’s do this the way we did back in the day – head into the boardroom with some something-something and bash out a few ideas?
Not for me.
Uh-huh. How would you feel if I …?
Really? Man?
What can I say. I’m Bacchus. I’m Type A.
Are you done?
No. Obviously – I don’t generally take minority stakes in public companies?
You’re a parasite. How about for once you make things bigger. With an old pal? Are you done?
Yes. I couldn’t begin to even think about this. But if I could. To sell it, I’d need it to be voting stock?
As long as the family maintain control.
Well, effective control. And I’d need a board seat.
I’d force it on you, dude. For the optics. Shit-hot new CEO has some hot-shit new money for investment? New generation. I keep the debt out of the news. Sisters are doing it for themselves?
I’m not necessarily totally opposed to this notion.
That’s right and luckily I speak Stewy. And that’s Stewy for ‘I have a raging hard-on for this.’
How much?
And listen, tell Paul to stick to jerking off at the opera. Rava’s still my wife.
You background-checked her?
No need to tell Ken.
Is that legal?
You don’t need to know—
I mean could anyone do that on … anyone?
First husband, you remember – Lebanese businessman. They had the high life in Paris, lot of parties, lot of pols and writers and also lot of slimeballs and fixers and shitbags and arms dealers. Oil guys—
And further back?
Further back is complicated. No leads.
Right. Is that—?
It’s weird.
It is apparently a little weird and there are two possibilities. Either, she came from kind of nowhere, Tripoli, Lebanon, turns up in Paris as a publishing assistant aged thirty-one and marries this guy, fine—
Or?
A clean-up job. Someone sometime tidied loose ends, did a deep- clean, bleached Google. Tied everything off.
Why would she do that?
Well – either, she didn’t, and you’re paranoid, or – there’s another possibility, and I don’t know what it is?
Hello. Hello, everybody?
Yeah, hi. You know Connor, Logan’s firstborn son.
Hi, Shiv, c’mon let’s …
And this is Tom, my, partner. And between them they are over twelve feet of we would like to see him please?
Good morning.
Are you going to force entry? Is that it?
Sorry I didn’t realize this would be framed so aggressively – I mean this is just normal. Let’s de-escalate?
He simply isn’t up to visitors.
Is this about me signing some pieces of paper or—
Shiv, please. It’s a very difficult—
Oh, the fucking waterworks now is it?
Siobhan?
I can’t believe you would try to stop me seeing my father!
I can’t believe you would try against his wishes!
Well it is nice to see you.
And how long are you in town?
I think she’s really upset but it comes out as anger. Pretty much everything comes out as anger with her. You look well at least.
She does look well. You also look well. Everyone looks well. Apart from Logan.
Dad—? How are you feeling? So, I wanted to come in. Um. Tom and I are engaged and—?
Where’s Frisk …?
The … You mean the dog?
Uh-huh? I love you.
I love you too, Dad. Mom took her to Italy. Yeah?
Everything okay?
Uh-huh. Thank you. He’s looking better.
The morning is not usually a good time. The morphine, he gets confused. He doesn’t want you all to see him when he’s not himself?
Uh-huh. Sure. He wasn’t himself.
No. And, Shiv—
Yes?
I’m a private person. Not all of us are born into good ease.
Right?
If you want to know anything about me, you can just ask me and I will tell you.
I just thought we were doing our plan, man. Shirts-off shit?
Retreat? Rome, this is a million times better, right? —
Good afternoon.
Thanks for making time for us, Mr Polk.
Not at all. And we’ve been looking at the terms we can offer and I think you’ve seen what we put together?
It’s a very brutal structure?
Well, these are the terms we think we can offer right now.
I mean the margin you’re making, you might even say you were— Well I mean blackmail is an ugly word. But so is getting goat-fucked.
I think we should keep things professional, don’t you?
Uh-huh. Sure. And professionally, we’re going to repay.
As in?
We’re good. Everything’s golden. We don’t need you. This can all stay private and I’ll be looking elsewhere for a banking partner as we go supersonic. Goodbye.
Um—
And fuck you.
I think, champagne for my friend?
Ken? I can have water with you.
No, it’s cool. I’ll taste it on your tongue later.
Bit creepy?
Not suave?
No. Nope. Have you been trying that a lot?
Oh, I thought that was— No wonder all the women I date keep throwing up in their soup.
So – is this the Stewy money we’re celebrating, I saw the news?
Well I’m not saying I’m the man but if there was a man, hypothetically, he might look a lot like me. I’ve solved the debt issue, with private equity money.
Well I’m very happy for you.
Yeah, well, the thing is, all of that, it’s made me think about – everything? And you know, here’s where I’m at: I love you.
Okay. Well. Thank you. Noted.
And – so—?
Ken?
C’mon?
Well, okay. I’m not sure I love you.
Yeah you do.
Fuck you!
Look. You want us to live separately, we don’t know why right now, but you say you do. Now that makes me unhappy. On the other hand, you claim – though of course I don’t believe you – that us being together will make you unhappy. So. One of us is going to be unhappy. I just don’t see why it has to be me?
Wow, I cannot argue with that logic. No, actually I can. Because it’s the argument of a psychopath.
At least let’s flip for it?
We are not breaking up.
We fucking are. I’ll do what I want.
Nope.
Yes.
B-man!
Nice office.
From up here, all the fucking ants, you can almost imagine they’re people, right?
So, you wanna work out down here or? We can parkour it or take my car to the park?
Well here’s the thing, Brex, I can’t run today because my back has been fucked since Monday.
‘Fucked’ how?
I assume you’re insured? I mean, I’m doing big shit, big big shit every day and so like losing even a quarter of a percent of my operating capacity, that has million- dollar implications. And I’m thinking, maybe, test case, I throw three or four dozen white-shoe lawyers at you and see what it would be like to actually physically destroy someone?
Dude. I don’t know what happened, but I’m sure I can fix it.
Fuck you – look at you, are you okay? No. I’m just saying, you need to take this seriously?
Sure. Look – what— It could be a trapped nerve but most likely it’s just a muscle pull. You want to lie down? I’m trained in deep tissue. Here. Okay.",0.37172997127271307,0.5208333033626362,0.2671717608315965,0.30058543567182655,0.29415619010263583,0.3211852270099571,0.35054621180929874,0.2524092310479195,0.4272204947073833,0.2981188540047003,0.1340399619859793,0.10100240745755323,0.1656407278299458,0.3797022336304693,0.3572005382186528,0.14618077831563808,0.2209509301622856,0.17411639103350246,0.10089097830952319
