part,script, 
5,"No, sir … That’s actually anti-racist and also racist. Which is kind of cool but also really not cool? So, shall we grab lunch then hit the road? I gots the old rumblin’ tum.
No. Let’s go before it snows.
Ken? I think your dad might ‘appreciate your input’? He’s thinking big?
Oh, look out, folks, here come the ‘top minds’!
Hey, what you got cooking?
Really no need, gentlemen, Frank wanted to fold you in. But you should know probably my thinking in terms of – things.
There’s a potential opportunity for some acquisitions and consolidation.
Packet of local TV stations.
Local TV stations?
No one watches TV, Dad.
TV is where the majority of people get their news. And more people watch local than any other kind.
Yeah. But not really.
Maybe raw numbers, but the demographic? I mean for Waystar, is it a good ‘look’?
‘I don’t know, Kendall, you tell me.’

You know there’s this fancy new business theory, son? It’s called, ‘make more than you spend and you’re King Cunt’.
These channels, they’re not exactly cash fountains?
We like the scaling opportunities and the bargaining power.
I like putting the knife in the rival canoes. We’re the number-five media conglomerate in the world …
Yeah, I’ll get the T-shirt made.
Time to be number one.
That’s great but it’s unrealistic.
And I want to look at a broadcast network. And I want to see what other news operations we can sweep up.
Oh, Dad! C’mon?
Why shouldn’t we do all the news?
Do all the news? Well, Kim Jong Pop, because that’s not how things work in this country.
You sure do love telling people what to think, don’t you?
Fuck off. People come to us because we don’t try to sell them on anything. No packet of fucking bleeding-heart United Nations Volvo gender-bender horseshit.
The strategy eventually would be that we’d support a range of news brand perspectives.
Bud. Miller. Corona. Becks. All the different beers are owned by one big bastard who wants to get you drunk.
The politics on this would be horrible. Justice, FCC. Antitrust. We’d be tied up for years—
Nah. TV’s getting fucked, it’s gotta consolidate.
Look. Fine. I don’t want to make this a thing – you like local TV, great, you’re smart. I just hope it doesn’t mean we can’t pursue diversification and innovation. The Biggest Turkey in the World
Of course. India. China. You know how many fucking people there are in Indonesia?
What? Sure. Who doesn’t. More than you’d think. A billion?
Roman, you’re a moron. I think you should get into all that for us, Kendall.
What?
Get back into that, over there. Vice-President Global and Digital. Out of Dubai, wherever. China, India.
Excuse me, are you serious?
Meeting’s over.
Dad? Dad! Dad! What are you doing? Are you okay? Stop, Dad!
Yeah. The long drive. I get it. Mom had a friend who was scared of flying? He actually died in a traffic accident. But he was on a bike. And heavy meds. So. But this is cool. We got this whole time to – talk about – whatever. Business. The future. Corporate structures? Or just – let the country music play?
No music. No chatter. Keep your mind on the driving.
Sorry, got a kind of an important meeting. Nothing to worry about! Just – work. So yeah, couldn’t sleep.
Yeah nor me.
Sometimes I thought I was asleep and I actually wasn’t. It was weird. But you looked like—
It’s not a competition, Tom. I was up till three-forty, actually, writing pros and cons of sticking with Joyce, on her PAC, and you were snoring like a hog. So?
Well my nasal strip fell off. What’s this?
The prenup.
Ooooh! Okay!
Yeah?
Yeah. It means it’s really happening? We’re getting married!
That’s a very romantic way of looking at a prenup.
You know what, I’m not even going to look at this. Just show me where to sign.
You have to look at it, Tom.
Honestly, honey, I’m not from money, you’re from money. I don’t want to look at it. I hereby comply.
I don’t want you to  . That’s not the basis for a healthy relationship.
Fine. Look, as a gesture of my love to you, I will have my lawyer look at it. But I want you to know, in my head I already signed it.
I hear your father is much better.
Yeah it’s great.
Just to say though. Down in the ‘Pig Sty’ we’re all huge fans of your stuff. The innovation.
Thank you. Like what?
Oh everything. Data storage. The digital guys I know were all popping. Not to sound cheap but the whole breakfast cereals thing?
The bircher muesli was off the hook. That shit was crazy. Were you involved with that?
So, I met the guy. ‘Sylvester’.
‘Sylvester’. And did you use a fake name?
I think Sylvester is his real name.
What? Who’s called Sylvester? Really?
Yeah. He’s – he’s just— We pay him. He’s normal, he’s legit. He’s on the record. He says it’s easy.
Okay. Because I’m worried. You know, after the Iranian revolution, the students taped back together the shredded documents from the US embassy?
He asked a lot about the digital deep-clean? And I said that was good. Emails and servers. Nice and general. Not specific. But that of course we’d wiped the specifics.
Great. But how does this part work?
We shred. Then some guys come in when we’re quiet, he suggests right away, tomorrow, Thanksgiving and ‘it’s possible’ they’ll dispose of all the unwanted material.
It’s ‘possible’?
They definitely will. We just need someone to shred and to sign out the materials from the document depository – and that name could – that’s a name that could draw heat, were things to go – bad?
Well I can’t do it obviously. Thanksgiving. Could – you?
Er. I mean. I could? It’s just. It’s— You know, the task in hand is a little—
No, sure. Absolutely.
You want someone you can trust. But who is, not ‘expendable’. That would be horrible.
Oh no sure. Totally. I get it.
Hey, buddy. What’s up? Am I going to see you in the office any time soon?
Uh, not that soon. I’m driving down from—
Uh-huh. So what’s your ETA?
About twelve hours? I’m in Canada.
Excuse me? Canada? Canada with the healthcare and the ennui? Why’s that, cock-sock?
Yeah. I’m just bringing my grandpa—
Greg, fuck your grandpa.
You’re actually on speakerphone, Tom?
Well I shouldn’t be, Greg.
Sure got it.
Sorry, Grandpa! Well, hurry up, Greg, yeah? I have a job for you. And I’m being nice cos I’m on speakerphone but if I wasn’t on speakerphone I’d be being, shall we say, somewhat less agreeable? Yeah?
It’s good. Rough and tumble, Grandpa. I call him a dicky too. He’s actually pretty lonely and afraid, I guess. Like we all are.
Fuck you.
Yeah, you can’t do it can you?
Fuck you. You fucking, piece of shit.
You’re a piece of shit, come on, come on, you fucking dirtbag.
No! What the fuck. I think I’ve made it pretty fucking clear I need a modicum of space once every twenty-four hours! Fucking come in, my heart rate’s dropping like a stone anyway!
It’s your brother, he absolutely insisted. I didn’t know …
Is it true? About the coffee?
What, Dad? Sure. He just kept pouring. It just went everywhere. It was like he didn’t even see?
Jesus. He’s not right.
Local TV, local news? Here’s a local news story for you: ‘Elderly Local Man Doesn’t Notice He’s Getting Butt-Fucked By Google’.
I am NOT going back to Shanghai. I   the company when he was sick.
Did you hear the way he talked to me? That was the tone, whole time I was at the studio.
 fucking patronizing.
Who knows how many people live in Indonesia? I mean who even cares? Fuck Indonesia. It sounds like a medical condition.
When I— When one of us eventually takes over what’s going to be left?
How many people live up your ass, Father Dickmas?
The firm’s being run by a compulsive hoarder. It’s this big old ugly spooky house and he’s all caked up in the middle covered in fucking moldy newspapers, with the local news blaring, feeding Wonder Bread to raccoons.
You gonna do something.
I should.
You should. And the only way he’ll respect you is if you try to destroy him. Because in your position, that’s exactly what he would try to do.
Yeah. I can’t do that.
Obviously. So. Have fun in Shanghai!
Hello?
Oh wow!?
You look incredible. Special delivery!
Oh? Enormous flowers!
So?
Oh what, sure. Yeah.
Heh. Yeah. Heh. So, yeah, work’s going okay I would say. Yep, working hard.
One of the symptoms of an approaching nervous breakdown is the belief that one’s work is ever so important. Bertrand Russell.
Ha! Yes indeed. Yes, sir. But I tell you what I sometimes think – I know you’re very busy with the ranch and your readings and research but I sometimes wonder if you wouldn’t, one day be interested in like, giving up your seat on the board and just –  out. Like really relaxing you know?
Life is nothing but a competition to be the criminal rather than the victim. Bertrand Russell.
Uh-huh. I don’t have a Bertrand Russell quote because this is the first time I’ve heard of him. But I do have this quote: ‘Just putting it out there.’ It’s a good quote. I don’t know who said it.
So, tomorrow’s going to be great. Just a fun day relaxing with family. So I thought we should spend a few hours tonight discussing strategy, key alliances, the whole ‘invisible chess game’?
Oh, Con. I’m really sorry I can’t do anything tonight, I have a prior engagement.
Oh? Right. No problem. I just thought we had two nights, tonight and tomorrow?
I thought it was tomorrow and Friday?
Hm. Well could I have tonight as well, on top?
You can have it however you want it, kiddo! No, no, I’m kidding.
I mean, considering the misunderstanding can’t you cancel?
Well no, my – friend’s – a theater producer so? But you’ve got me all day tomorrow? And I’ve got you.
I think I just licked an air freshener. I thought it was candy. Do you think I’ll be okay?
How was it? How are you feeling?
Great.
So I have some news. Ewan is definitely coming, for Thanksgiving.
Ewan? Bullshit. Why?
Why? Well, he asked and said he’d like to come and I said yes.
You’re a pretty good liar.
It’s not good to have rifts in the family.
It’s not a rift. He just lives in Canada. And is a prick.
Uh-huh? How long since you spoke?
We send him a fucking birthday card don’t we? Not that I get any thanks. Think I need some physical therapy.
Of course.
The other kind. The Joy of Painting .
Look, you didn’t come back out of love for my father. So I guess what I wanted to ask was, what’s your plan?
Ever heard of loyalty?
Sure, wasn’t he one of the Seven Dwarves? No? A rapper. Was he a part of the Wu-Tang Clan? I’m sorry, I gave everyone Thanksgiving off. So, look, Dad’s not well, right? The business decisions are not cogent, they’re old-man shit. But that’s his call in some ways you know, but he pissed on my fucking floor? What if that got out? No one wants to say it, but we can because we basically love him, but he’s not okay. What about he wakes up one night fucking calls – Bezos and sells us out for a dollar? I just want what’s for the best.
Ken, I’m an old man.
He’s sick. Do you think the real Logan would want us to stand by and watch while he throws it all away?
Talk more.
Happy Thanksgiving, Mom. I know. I’m sorry. But we’ll see you at Christmas— or New Year. Maybe. But listen, thanks. Thanks for all that. No, I understand. Love you too.
Is there a problem?
No. No. It’s fine.
What is it?
Nothing, it’s just my lawyer says—
You mean your mom says?
She’s a highly respected attorney in the Twin Cities?
Sure, so what did your mom say?
She says the prenup is a little bit—
What?
‘Unconscionable’. I mean, that’s a legal term. I don’t care—
Fine. We’ll change it. Guess I just got Wambsganned, huh?
What can I say? She’s a hard-ass.
I tell you what is unconscionable. Cranberry sauce in a can.
I know, but your dad loves it!
So, there’s Roman, me, you, who’d stand up against him—
Don’t you have the pods?
The pods? Three grams of coffee in six grams of packaging? The inventor of those is basically Oppenheimer.
Ewan is never there so he won’t vote.
And even if he did, he hates Dad. How about Gerri?
Gerri? You’re dreaming. But I think – yeah, if – there’s no Ewan. Looking at the numbers, yes, you know Asha, Stewy, Roman, Lawrence you can firm up a couple of doubters. Yep – it’s definitely possible?
No CEO has ever survived a successful vote of no confidence, right?
You know, honestly, I think he might be looking for a way out?
That’s the spirit, killer. So, are we doing this?
Don’t ask me. He’s your father.
I’d be doing it for him. Carla! Where do we keep the fucking coffee beans? Skeleton staff.
I mean, do we even need to have one?
Yes, my mom and dad’s divorce was horrible. I just don’t want more … mess.
But we’re not going to divorce.
Uh-huh? You write a will, don’t you? Even though you’re not expecting to die?
I am expecting to die, Shiv. Sorry, maybe I should have mentioned that when we first started dating.
Happy Thanksgiving!
Happy Thanksgiving!
Ewan. Happy Thanksgiving! I’m so happy you came! He was asking for you when he was in the hospital.
Must have been the drugs.
He’s tough I know. You’re a pair of noble stags who can’t stop butting heads! Thank you for driving him down, Greg.
Are you kidding? Great to spend some quality hours with you Gramps! And how, may I ask, is Logan?
Oh you know. But together, Ewan, we will cheer him, yes?
Well, that’s not up to me.
The Thursday box office is trickling in and it’s  . How is that possible?
It’s possible because, people are idiots.
Happy Thanksgiving to my favorite stepmom. Remember. No tongues, Mom!
Welcome. Grace. Isla. —
It’s just depressing is all.
Rome, that’s why it’s hard to succeed – because how can geniuses, like us, figure out what morons, like people, will like?
Yeah. You, me and Roman? So long as everything else went our way? Vote of no confidence and kaboom.
It doesn’t need to be horrible, right?
Sure. He tells the world he’s decided, following his illness, it’s time to step down?
I mean it will be fucking horrible.
Hey. What are you up to?
Nothing.
Are you smoking weed?
No.
Do you want to?
No.
Watch the door.
No … I shouldn’t. Tom might want me to—
Come on. Don’t be rude. It’s the weak sauce, Greg.
Frank. Thank you for coming.
Not at all. Kids are in Denver anyway. We’re meant to alternate, but it never seems to be my year. I like to think it’s all about the stuffing.
For Dad.
Thank you. Kendall – say hello to your uncle Ewan.
Ewan’s here? Uncle Ewan?
Yes. Isn’t that nice.
Oh my god! This is so strong.
Is it?
Oh yeah. You think I smoke schwag? Yeah, you’re gonna be  high.
Oh,  . No.
Fuck!
What?
. Now they think it’s going to set a fucking record for Thanksgiving box office.
That’s us, right? That’s ours?
It’s not a good film, Greg. When he was at the studio, he tried to stop it. But he got overruled by the jerkies.
Oh right. Although I guess it has made Roman and everyone more money?
That’s not the point.
No, of course. No?
There you are!
Need more booze!
Happy Thanksgiving.
How was the trip? I hear Grandpa Ewan’s quite the character?
Oh, he’s okay. Eventually I found an economics podcast he liked to shout at.
Uh-huh uh-huh. So listen. I actually need you to go into the office today. That cool?
Could it wait till tomorrow because I just drove all the way from …
Has to be today.
But no one will be there?
Exactly. Greg. Listen to me. What do you want to do?
I was hoping to just eat some turkey and …
With your life? Where do you want to be in five years’ time? What are your hopes?
I haven’t really …
What are your fears?
Well, I mean, you don’t mean just spiders … you mean—
You and I have had our bumps, Greg. But I want you to trust me. And I want to be able to trust you. Yes?
What do you want me to do?
I have absolutely no idea. It has nothing to do with me. And we never had this conversation.
Okay? I mean I am going to need a little more detail, man, because —?
You just need to go to the office. Sign out some boxes, do some shredding and meet some lovely guys?
Oh what? Is this the thing?
Why are you making this a big deal, Greg? It’s not a big deal. A chimp could do this, Greg! A little chimpanzee!
Welcome, welcome.
Happy Thanksgiving. This is …
Yes, Willa. I heard you were coming. But I didn’t believe it.
Happy Thanksgiving! I hear this is Logan’s favorite?
How kind. More. Excuse me? Gerri! Gerri? No? From Arnaud Larher? Oh, no, too kind.
Well, we can’t all bring cranberry sauce!
What would we do without you? You are so good to us. It doesn’t go unnoticed.
He brought her to Thanksgiving?
Do you think she charges overtime for holidays?
It’s not cool, man, one day that’s a story?
Oh, did they bring cranberry sauce too?
Forget it. You can’t get him anything. Last Christmas. I thought I’d had an idea, new MacArthur biog. He got seven copies.
So what the fuck is Ewan doing here?
Plan is a big reconciliation.
That would fuck your numbers. Whose idea was it?
Marcia, I think. You figure she’s on maneuvers?
Your dad’s suddenly all about changing the trust? She invites me  Gerri to Thanksgiving?
Amir, where are you?
I’ll be there in five minutes.
Hey. Good to see you, Uncle Ewan. It’s been too long.
Uh-huh. Likewise I’m sure. So, where’s my kid brother?
Dad? Resting, I guess.
I drove five hundred miles and he can’t come downstairs?
Yeah, I guess he’s still pretty sick. So. I mean, he’s up and about. But he’s … not really … quite his old self? He’s actually acting kind of … strange.
Like inviting me for Thanksgiving?
It’s good to see you. I’ve missed you, Uncs.
So, how’s it going? So sorry about your – woman, Shiv.
Joyce? She won, Grace. She’s a US senator.
No I don’t think so – because—
I’m pretty sure. I was there. I was up for seventy-two hours. It was kind of a big deal for me? I’ve been asked to be senior advisor.
Oh. Well, congratulations?
Thanks.
You did a great job because she’s quite – unlikable.
Well that’s true I never liked her.
Oh really. And why’s that?
I guess, kind of you know, kind of phoney. Kind of scary.
‘She want to take all my lovely money!’
Uh-huh. That’s, interesting. I mean too fake   too real?
Yeah. It’s weird. I guess she just comes off as a sort of a – bitch? You must hear that a lot?
Yeah, I mean, not usually from family on Thanksgiving …
This is what you’re dealing with, Shiv. This is heartland right here.
You don’t think she has a sort of, presidential quality?
Fuck no.


And who’s that?
I think – Marcia’s son?
And who’s that?
With Connor? Oh, that’s his whore.
The woman talking about theater?! Does he know?
Of course he knows. He pays her to suck his cock.
No way!
I actually introduced them at a party a few years ago. She wasn’t a call girl then. Well, you could call her. She just hadn’t figured out she could charge.
Oh, man, she’s coming over.
Okay, soldier. You ready? Just getting the deets!
Happy Thanksgiving!
Happy Thanksgiving. This is my cousin Greg. He’s very excited to meet you. Would you excuse me?
Hi.
Hi. Happy Thanksgiving.
Yes.
Sorry, did I interrupt something?
No. No! We were just … We weren’t talking. About anything. We were just … talking about the theater.
Do you like theater?
No. Not really. I mean, I haven’t seen a lot. But of the stuff I have, not really. So, here’s a question. Would you rather be trapped in a swimming pool with a shark or in a cage with a tiger?
Um, maybe in a swimming pool with a shark. You?
Yeah. Same.
Hey man! Good handshake. Firm. I can already tell I’m going to like you.
Okay. Well, I like your handshake too, I guess.
And I’ve shaken a lot of hands. A  . Handshake buddies! Okay you! Okay. These are the file numbers. This is the room number. You good?
Shame I wasn’t on a percentage?
I’m sorry?
Because I introduced you. I’d be a rich man by now! Oh. That’s right. I am anyway.
May I ‘cut in’?
What? I was ironicizing. I just think it’s better to be honest about this stuff, we’re all just raking the green, baby.
That’s enough.
Nothing I can’t handle.
Listen, Willa, here’s the thing. I hate the ‘jokes’. And I hate the atmosphere – and I’ve been thinking. And I have an idea. You’re such a great person. Such a great writer-producer. I want to help you. With your career and … really the financial aspect isn’t a concern. I can fund your work and—
How do you mean?
I mean, I’d like us to be kind of … ‘exclusive’? You’d get to stop hanging out with other – people – and you’d have more free time for theater? What do you think?
Well it’s obviously intriguing.
And if you wanted you could live with me in New Mexico?
No.
Of course. I mean—
I mean I need to be in the city for my work?
Well that works too! Look we can discuss the details. But it’s just great you’re open to this – this— this opportunity, for progression. It’s intriguing! It’s so intriguing it’s kind of making me horny, is it you?
Should we keep on waiting indefinitely for Rava and the kids before we eat?
They’re on their way but … please, go ahead. It’s hard for her, you know, her stepdad is very demanding so—
Of course, it’s just a shame they couldn’t be with us for the whole day.
How about Dad? Will he be joining us at all?
He’ll be right down.
I’m worried about him, Marcia.
I’m worried about you. When I see you, you always look so tired. We both just want you to be happy.
Well I am happy. Mission accomplished. Don’t worry about me.
Shiv’s found something she loves. What do you really want to do?
It’s clear what I want to do. And what do you want to do, Marcia?
Oh, just to look after your father. That’s all.
Uh-huh? Yeah?
Logan! Look who’s here!
Well, Ewan.
Logan.
How was the journey then?
Extremely long. You look terrible, I must say. ‘Haggard’.
Thank you, I’ve been extremely unwell.
Alright. Everyone! Food’s ready. Please!
Go ahead please, we’re eating ‘family style’.
Oh, ‘family style’, what almost like we’re a family?
So. How’s the ranch?
Well why don’t you come and see for yourself sometime?
Thank you, what a kind invitation.
Any   issues. Huh? When we were kids, my uncle used to get us to kill the squirrels. I’d throw them in the trash but Ewan used to bury them with Palm Sunday crosses for headstones.
That’s sweet.
One time, Ewan had been watching them tanning hides at a ranch. Tell them what you did.
I decided to tan a squirrel’s hide.
And how do you do that? Pray tell?
Skin it. Wash it, dry it. Then you use the oils from the brain to tan it.
Bullshit!
Every animal has a brain big enough to tan its hide.
Naturally.
You basically cook the brain into a kind of soup. Then you mash it … .
I’m glad we’re having this conversation while we’re eating.
I must write down this recipe.
I think it’s in Gwyneth’s Goop book.
Then you rub the brain soup all over the hide. Put it in the freezer. Stretch and soften it. Then you smoke it.
You smoked squirrel? Grace, didn’t you try that?
And then what did you do with it?
Used it as a blanket for his teddy bear.
Did one of the serial killers do something like that? I mean yours sounds cute.
Took him about a week all in all. But you tanned that tiny hide.
I did. Till Aunt Vee threw away the blanket and she threw away the bear. Never been able to hang on to anything, have I, Logan?
Hi, hi, sorry we’re late— Happy Thanksgiving! We’re on the turkey trail.
Hey? Where’s Iverson?
He’s outside. He’s just having a … moment, guys. Sorry. I’ll stay sitting with him.
It’s fine. I will. I thought we were in first position?
Don’t go out there. Get him in here! He needs to be told.
He just needs some time. Transitions are difficult.
Maybe we should tell him to come in? Few more boundaries?
Er – these are the boxes I need?
Okay. Pass?
And you presumably, you keep that. Obviously. The record of who got what, when?
Uh-huh.
And that record? Where does that information go?
No idea.
Cool. Great. Who cares, right? Just asking cos. In terms of sharing it with third parties? I just like to keep pretty a tight handle on my data!
Man. Your dad. Fuck  .
I know. I guess, he had it pretty rough. Different generation.
Uh-huh, go back, I’ve got this. I’m sure it’s my fault anyway.
I wasn’t saying that, Rava, fuck, I was just saying maybe Iver would like to feel where the line is sometimes?
Come on, your food will get cold.
Why are you calling me? Do not call me. Is there a problem? Don’t tell me if there’s a problem. Don’t tell me anything. Your phone shouldn’t even be on.
I signed at the depository for the document crates? And I’m in the room, Tom. Is that okay?
Well you know what to do?
But is it okay? Because it feels like a Watergate scenario. And I never studied it but I believe I am correct in saying they all got fucked.
It’s okay. Greg! Of course it’s okay. It’s a job.
So Logan, when do we get to see the famous medal collection?
Oh, god, please no. Wait. Did someone pay you to say that?
Maybe some other time?
My dad was a naval officer. I’d love to see them?
Me too. Might inspire a jewelry piece. I mean, medals are basically jewelry but for killers.
Everyone take note, this was not my suggestion.
And are they expensive?
Varies. This is a Victoria Cross.
You should collect something like this. It’s nice to have a hobby.
Uh-huh, you see me stamp collecting? I guess I could show you my rusty sheriff’s badge? Shiv’s got a big collection of pictures of those.
Yeah yeah yeah.
This is a World War I 16th Canadian Infantry medal.
Uh-huh?
Now, of course the Assyrians wore medals before the Romans but this is Roman and—
And excuse my ignorance, but did you win any of these?
Ha! Of course not, he’s never served.
Is it okay if I—?
Maybe don’t touch. This one did cost rather a lot.
Not as much as it cost the man who won it.
I collect them out of respect.
Oh I’m sure.
Look, fifty years ago you volunteered for a war because you wanted to impress the town slut and no one’s ever allowed to hear the end of it.
I thought Canadians only fought on ice!
Thirty thousand Canadians fought communism in Vietnam.
Yeah, thank you, thank you, thank you, what do you want, a medal?
Kept us free.
Viet Cong coming up your drainpipe in Ottawa were they?
Free to pump your poison. Carnival barker for all the oil wars we didn’t need.
Did you even fire a gun? Didn’t you end up cleaning grill for the catering corps?
C’mon now, please—
They should send you the bodies.
‘Bear any burden, stir any gumbo.’
I don’t have any of your channels in my house. I see them at the place I go for noodles. And I’m frankly embarrassed.
Bullshit, you don’t have them because you’re bitter.
Climate change! The blood of billions on your – hands.
Yeah yeah, you got your fucking nut, Captain Cautious.
Everything isn’t about money, Logan. Have you ever heard of ethical considerations?
Uh-huh. Ever heard of a begging letter?
One fucking letter? I got a thousand acres, you got the rest of the world.
Oh yeah, big man, big brother, wouldn’t eat a blueberry till they’d been weighed and written in the ledger? Little Miss Prim.
You can’t say who I am, you are not the arbiter of what’s true!
Yeah yeah. Heard it all before.
I was told you were ready to apologize.
For what?
You’re all liars. You’ve lied to me and you’ve humiliated me.
But apart from that have you had a nice time?
Are you trying to leave dramatically, Ewan?
You may have dragged my grandson into your filth but you won’t drag me.
I’m so sorry.
I can’t think why we don’t invite Ewan every Thanksgiving.
I mean, I don’t know what I’m doing. But if I did, it could be really serious.
You don’t know what you’re doing?
What, really?
Yeah, really.
Well yeah really I know what I’m doing, obviously. But I think if it came to court or something I could get off by saying I’m like a ‘goofy dolt’?
Yeah I think so.
Well don’t assent so readily, Mom?!
I’m just agreeing with your idea, Greg!
The thing is – even if I play the, the, hapless jerk— You know the Sarbanes–Oxley statute? ‘Obstruction of justice’? ‘Spoliation’? I could get fined up to a quarter of a million dollars. Or twenty years in jail. I don’t have a quarter of a million dollars, Mom.
Well, son, you need to figure this one out? Okay?
D’you think, Mom? D’you think I need to figure it out?? I’ve fallen down a well here and you’re shouting, ‘You’re inside a well!’ Jesus!
Hey!
I knew it was a mistake. I’m going.
Can we talk?
You can try. He lies. And he thinks he’s telling the truth. It’s infuriating.
Yep.
All I ever got was a mouth full of garbage.
He’s tough. He is tough. There’s something in there, but he’s tough.
I thought nearly dying might have changed him?
I think he has changed. I don’t think he’s himself at the moment. He’s a lot sicker than he’s letting on.
Uh-huh?
He’s erratic, he’s making bad decisions. I’m serious. If he’s not careful he’s going to destroy the company.
And you have a plan?
I’m considering. Look. I never got a chance to know you, Ewan. But I liked you. I’m going to say something now. And I’m, I’m putting my prick in a cigar-cutter here. But at the next board meeting, there’s going to be a vote of no confidence. I mean, do you have confidence, in him? So. What do you say?
My brother is an ex-Scot, ex-Canadian, ex-human being. But he’s my brother and I won’t betray him.
Okay. I get it. Let’s talk? .
Greg’s getting it done. He’s not having fun. But he’s getting it done.
Do you think it’s all going to be okay?
This is no way our worst Thanksgiving.
So apparently your lawyer is talking to my lawyer.
You mean your mom.
Yeah. She’s got all excited about bumps and tiered share option tie-ins for my sperm count et cetera and I’m just saying no no, but she noticed re infidelities there’s no—
Yeah we don’t need to do that.
Cos that’s not going to happen.
Right. And if it does. You know. We’re both grown-ups.
Yes. Meaning?
I don’t know. Nothing’s going to happen. But, things happen. We both travel.
I don’t travel that much?
Yeah, well, anyway, point is – shit happens.
Does shit happen?
No. Not to us. No. But yes shit happens. That’s why we have the expression, ‘Shit happens’. Tom. I have not cheated on you. Because I love you.
Thank you.
I believe her. Do you believe her? Of course, she does coach professional liars for a living. So you do have to factor that in.
Thanks, guys. Thanks! Just another bunch of corporate materials. Headin’ for an extra shreddin’! Happy Thanksgiving! You’re doing a great job! Really proud of you! Have a good one, guys!
Uncle Ewan – what have you got in mind? Because I have to say, I was only kicking some notions around? Nothing is set, so I hope you’re not going to make a big deal of this?
I’m only thinking— It’s for his own good, for everyone’s good.
You know it’ll kill him. Is that what you want?
Of course not. I want him to be able to relax.
Right. What a son. Lovely. — Forgot my stick. We’re going. Come on, Greg.
Oh, okay? It’s just, I only just got here and – tomorrow I’m kind of busy. I have stuff to, they need me here, basically. I’m kind of important … and pretty hungry so—
How am I meant to get home?
Uber?
I’ll call one of our guys.
This whole family is a fucking nest of vipers. They’re wrapping themselves round you and they’re going to suffocate you.
Pretty sure that’s boa constrictors, Grandpa. Zoology.
Okay. You, enough. Get in there now. See? The Biggest Turkey
What are you doing? Who put this on? Gracie.
Why are you laughing?
The big turkey just ate the family’s corn.
And you think that would happen? But how did it even get from Colorado to eat the corn? Exactly, that’s a big plot hole right there. Enjoy the movie, kids. Grace?
Assholes.
Hey that’s—
What the fuck, Grace?
It was just there. I’m sorry. It’s actually pretty good?
Yeah? Is it. Is it? Really?
Yes.
Well look. Fine. But I think we have irreconcilable differences, so. I think we need to have a talk.
What talk?
What talk? The ‘I’m sorry – insert name here – it’s just not working. I hope we can always be blah, let’s keep in blah, I’ll never forget such and such …’ That talk.
Oh right, that talk? The ‘why do we only fuck once every six months’ talk?
Yeah fuck you. You got plenty.
All good?
All done.
I don’t want to know and don’t ever tell me. But well done. Here.
Thanks, man.
Welcome to the family.
Okay, everyone. Ready for pie?
Hey listen, I have an idea. We should do what my family do at Thanksgiving …?
Fuck the turkey?
Go to other people’s dinners?
We go around and say what we’re thankful for?
Very well. Yes. Let’s do that. You go first, Tom.
I can’t go first. I need to go last because … I’d like to go last.
Okay. I’ll go first. I’m thankful to have the family all together.
I’m thankful I wasn’t born a Siamese twin.
Because?
What, you would? To be like fused to someone by the chest. Or to have two bodies and one head. C’mon. Gross.
Yeah I guess I am thankful for that. And I’m thankful for this delicious food.
Yeah me too. The food. Amazing.
I’m thankful that Uncle Logan is feeling better.
I think we’re all thankful for that. That goes without saying.
Me? I don’t know. I’m thankful I’m not in a refugee camp I guess, this is better than that.
And so say all of us!
Well. Can I say? I’m thankful for the opportunity to head up animation in Europe and I hope to turn around an underperforming division.
Well I’m thankful you told us about that, Dad?
I am thankful for, uh okay, for my two boys … And while work has often kept me from seeing them as much as I’d like, I – I have been able to provide for them and their education.
I’m thankful for Frank not oversharing.
I’m thankful to have Willa here.
And I’m thankful to be made to feel so – welcome.
And   thankful that I’m going to be marrying into one of the most – interesting and vital and— kind and loving families in the world!
Let’s hold him down and cut out his tongue.
Please?
Well since we’re talking families. I have a little announcement! Willa and I are pleased to announce I have asked her, and she has agreed that we are to … take the next steps.

No, we’re … we’re, going steady.
You’re ‘going steady’? What are you, nine?
Me? Oh I’m thankful for all the love Roman has shown to me and for never being selfish or self-centred or egocentric or neurotic or unfaithful.
Okay, a game? Shall we play a game. Let’s gather the children!
Congratulations on your ‘next steps’.
Thank you.
I’m interested to know what ‘next steps’ actually means. Is there a greeting card I can buy that says, ‘Congratulations on  ’?
Your good wishes are all that’s necessary.
Is there a ceremony? Or is it more of a financial arrangement?
Hey, listen. At least I’m only getting fucked by one member of this family, yeah?
I went to the market and bought a pony, a big fat hen and this …
I went to the market and bought a new hat, a pony, a big fat hen and this.
I went to the market and bought a crack pipe … What? What? Okay, okay, I bought a gimp suit … Fine. I bought a potato, a new hat, a pony, a big fat hen and this. Come on, Dad, what’s it going to be? A hot dog. China. Immortality. Huh? The soul of the nation?
You went to market and you bought?
I went to market and I bought. Local TV.
Okay. Local TV and …
Can he buy that?
Dad gets to buy whatever he wants. So, come on, Pop – ‘and’—
What …  ?
Clock’s ticking. Time’s running out. Local TV, and what did I say?
Um …
A potato.
Cheating! Come on, Dad!
Big … turkey?
Don’t mention that in front of Roman!
You lose. Grandpa loses! You lose, Grandpa! You lose.
What the fuck are you doing?",0.3668462945981014,0.5226179790541025,0.27881276661774806,0.2686304164639974,0.3298382906640793,0.31238628995715306,0.2809572141174566,0.24853492220686116,0.33195553669484995,0.27062948191759445,0.15395243470044018,0.0744383014732147,0.1508493794649208,0.38728467054404636,0.3762737996639463,0.1426070383394737,0.21476325702012944,0.1531776392642977,0.12209364086620399
