part,script, 
1,"Where am I? Where the fuck am I?loyalty, distrust, generosity, fear, kindness, gridiness, hope, friendship, anger, justice,love, forgiveness, envy, betrayal, cruelty, jealousy, injustice., revenge, hate
Logan? It’s okay, Logan.
Ugh. Okay. Okay.
It’s okay.
Where am I?
It’s okay. We’re in the new place. It’s okay, Logan. Waystar Royco is a family. A family that spans four continents, fifty countries, three divisions: Entertainment, News and Resorts. Working together. To provide a net that can hold the world, or catapult it forward. To the next adventure! USA Today The Correspondent— Chicago Daily—
Joining Waystar Royco you’re joining one of the most dynamic news and entertainment companies in the world. Feel it! ™
How we feeling. Ready to go? Okay? You in the room?
Uh-huh. Yep.
And who are you playing today?
I’m not playing anyone. I   Doderick.
And Doderick is?
Doderick is mild-mannered to a fault. Puppyish in my enthusiasms. Playful, eager and lacking in guile. I am the best friend to all I meet.
Okay. Let’s go, folks!
Brooklyn, Bronx, Queens and Staten From the Battery to the tip of Manhattan Asian, Middle Eastern and Latin, Black, White, New York, you make it happen! Apologies, Fikret.
Yeah? Hey hey hey, man! Good to see you. So. Where are we? Are we ready to fuck or what?
Yeah. Okay. Look. I’m really sorry. But it looks like there’s an issue.
How do you mean, dude? I’m here?
Yeah I’m sorry, but we’ve been looking at the offer, while you were in transit, I mean really looking at it.
What, before you didn’t have your glasses on? You were smelling it? Huh? I got the call.
I’m sorry, but it won’t fly – with my board.
I was told it did?
Yeah well it won’t. Not this actual number.
I came all the way down here, dude?
Well, I’m sorry, ‘dude’.
You know I love what you do. That’s been made clear? I’d love to keep you and your team in place, Lawrence? I love Vaulter.
Sure. I just think bottom line, I can deliver a lot more value for our shareholders. Hope I haven’t inconvenienced you?
I see you. I see this.
We’re grateful for your interest in our little outfit, but I think that’s it.
You got the message? I am not letting you Neanderthals in to rape my company. Ever. You’re a bunch of bloated dinosaurs who didn’t even notice the monkeys swinging by till yesterday. Well fuck you, daddy’s boy.
Oh what? Please.
I’ve got a track record from founding one of the most exciting new- media brands in the world. What have you got? Track marks from shooting junk? Thanks for coming down. Great to meet you. Sorry this isn’t going to work out.
It’s going to work out.
No it isn’t.
What the fuck? Frank. How did this happen? How can we sweeten this?
You still want to pursue it?
Of course I want to pursue. I want to announce. This is part of the whole thing. Our offer is fucking good right?
You want to bump the offer another point? You wanna call your dad?
Do I want to call my dad? No I don’t want to call my dad. Do you want to call your dad?
No.
Does anyone want to call their dad? No one wants to talk to a dad. Good. Okay, so, we’ve started so let’s buy this fucking company? I’m pushing the bid to one-twenty. Okay?
Okay.
How’s it going? Did you close?
I’m right in the middle, Dad. Yes it’s okay! We’re not quite closed. I’m going to one-twenty. So that’s good. And are we still on for the announcement?
Uh-huh.
Great, cos obviously I’m soft floating to like Frank and Rava? And there’s obviously gossip getting soft floated.
By who?
By the ether. I don’t know. Well look, happy birthday, old geezer! It’s exciting. This is going to be great for you, Dad.
I’m excited. Marcy! I thought this whole place was going to be ready? Have they fucked us on the internet because—? My emails— I’m going to call, Ellison or Gates because my emails are— Pencil! Where’s a—?
I think it’s all up, Logan?
I’m not getting anything. Who do they think I am? Uncle Fuck. It’s not working, I’m not paying until—
I think maybe you just didn’t get an email for like ten minutes?
Uh-huh. Okay. He’s started floating. That wasn’t the arrangement. He’s offering one- twenty. He’s got a hard-on. You don’t walk around with a hard-on. Makes you look ridiculous. Get it trapped in the eye of the fucking Halloween pumpkin.
But the me thing? You’re okay on the me thing?
I’m on it, Marcia, don’t worry.
I mean not that I mind?
I do.
This is going to be great for us though. Did you see the brochure I sent? The Galapagos thing?
Oh, yeah? Great. Turtles, all kinds of disgusting shit. Terrific.
A lot more cards? Presidents, prime ministers, royal crests.
Just have Jan log them— so I can see which fuckers have dropped me already. Marcia—
What?
Look I’m not about to spill my guts like some queer. But you know.
Thank you. I love you too.
I’ll be back by Sunday night so I’ll look at his speech with him then, okay?
Okay but his office wants the poll numbers by the prekend.
By the ‘prekend’? What the fuck’s the prekend?
The prekend is Friday.
If he wants them by Friday can he not say Friday?
Thursday lunch to Friday p.m. is the prekend.
Fine. Get Rennie to put them together. Okay?
Ugh. This is a fucking disaster. Shiv? Can you— I need to strategize my gift? What can I give him he’ll  ?
I don’t know, my dad doesn’t really like – things.
He doesn’t like ‘things’?
Not really, no.
Ugh! It needs to say, I respect you, but I’m not awed by you. Start a fresh chapter. What says that?
A pen.
A pen?
Tom, every gift he gets will mean an equal amount of nothing to him. Just make sure it looks like ten to fifteen grand’s worth and you’re good.
Ewwww! He’s puking out of his  !
Fuck  .
Protein spill. Head stays on! Head stays on!
Greg? Are you okay? How’s it going?
Going great.
Uh-huh, so why are you calling me at six-thirty in the morning?
Yeah, great but also – Mom, sorry but I screwed up. Well not me – but look, a, a – kid smoked a joint in my car.
‘A kid’?
Uh-huh?
And so, if you can believe it, the car smelt like skunk weed, and I guess I smelt like – well you can see from there, how I got implicated in this kind of tragic misunderstanding?
Did you – tell them – who you are?
No. No. I thought – no. I didn’t want to be an asshole. Or – get into it all. I don’t know. I liked it. I’m sorry, Mom, I’m such a fucking screw-up!
Okay. Listen to me, here’s what you’re going to do—
Okay. Uh-huh.
What? What do they say to one-twenty?
They’re not going to budge unless it gets to be a stupid number.
What’s a stupid number?
What’s a stupid number? A badillion? I don’t know.
Because one-twenty is stupid.
Look, I think this is clearly about Lawrence. Should we look at his package?
Okay. Who’s this? Is this news?
Hi, Kendall Roy?
Hello?
I was sent by – Roman. To burn some sage?
Excuse me?
It’s auspicious? I’m a business alchemist. It’s a gift, from your brother.
Will it set off the smoke alarms?
Not usually.
‘Not  ’?
Yeah, we’re looking at a billion-dollar acquisition so I think we’ll need a little more reassurance before we break it up with a building evacuation?
Hey hey hey, motherfuckers!
Roman.
My guy? Are you saging?
We’re just concerned about the alarm?
Right, bad juju. Maybe you should make a move, dude?
I can use essential oils?
I think just fuck off thanks. How’s it going?
Good. Just finessing. You okay, man?
Of course I’m okay. Obviously I’m okay. Why do you ask? What here? Oh, man, I’m so over all this. I was a bad fit. I was never a corporate cock-suck anyway. Besides. I never got this high in the fucking building! They stuck me in LA with Old Father Time, we were the pool boys, right, Frank. Fucking banana cabana? So. What’s the bid?
Well—
What that’s ‘commercially sensitive’ – I’m still on the board, bro!
Going one-twenty-five.
One-twenty-five! Fuck!?
What? High or low?
Whatever! For Vaulter? Bit of content and a brand name? Your funeral. You’ll be captain soon enough. Oh c’mon, every intern on the Street knows you’re stepping up. Congrats, man, congrats. So pleased to be out. The company was essentially a cage to me. Well, congrats. I ought to head. Look at all this fucking bullshit!
Marcy, I’m heading out, as ordered.
Great, till one should be—
Fine – but just here – yeah? I don’t want to get a fucking heart attack from the surprise. Have them here. And not too loud. Just – a—
You want me to email you the exact details of the surprise?
Dad?
How’s it going?
Fine. Good. Why are you—? Are we okay?
Oh yeah. Yeah. I just have some paperwork—
Ahead of the announcement?
For putting Marcy on the trust. Just bullshit. But I felt like checking in.
Oh. Because on my announcement, what’s the precise timing on that?
Let’s see how this goes and I can lay it out.
Okay? So this is just the trust? It doesn’t affect me stepping up?
Nuh. I think I told you about—
Dad – I’m busy, do I need to lawyer all this?
It’s housekeeping.
Fine. Marcy’s fine by me. I mean the others, might not feel the same?
I’ll deal with that. Okay. So – I’ll see you in—?
Yeah look, Dad, on lunch. I really want to be with you but the deal—
If you need to stay, you need to stay.
I really want to be with you?
I appreciate it.
It’s just, delicate. I mean they can handle it but—
. Any indication. Call me. Okay? And look, this is gonna get press-released, but – by tonight I’m going to be Chief Exec of Waystar. . I just wanted you lowlifes to be amongst the first to know, okay?
Congratulations.
Thank you. Okay. That leaks, you’re all fucking fired! Off we go let the trumpets blow Because the driver of the mission is a pro. The ruler’s back!
Okay, guys – can we back off, private event? Freelance? Could be getting colder out there, boys. Mr Roy. Logan, you going today? Is that right?
Fuck off.
Hi. Hello there!
Can I help you, sir?
I’m actually – I’m here to see you!
Can I see some ID?
I’m Greg? Marianne’s Greg? Your nephew? My mom called Marcia and I heard – I checked with the – the man and he called up and said it was all okay—
Oh. Right. I didn’t know you were coming?
Yeah I’m— I think you did?

I’m on my own. I hope it’s okay. I wanted to say, many happy returns.
Thank you. You okay?
Oh fine! Seriously, fine. I get it. I could have been anyone. An assassin. You could be dead now, or dying. But – yeah. Happy birthday!
Hey, Global Tom! How you shaking? You still fucking shit up for us?
Ha! Still tidying up your mess, pal!
Sis. The pols still boring the living shit out of you?
Yeah, you know, still burying the bodies and counting the cash.
Ha! Look at you. Walking around like you’re an actual human person!
You smell good. What is that? Date Rape by Calvin Klein?
Yeah you wish!
‘You wish’?
Okay! He’s back! Folks, he’s back! Can we – can you find somewhere?
It’s – a long way up.
Ah?
It’s— We’re going up?
Uh-huh.
So great to be here. I thought you would have known. I hope it’s okay?
Sure. Good to see you.
I actually came because, I needed to ask something?
Uh?
Yeah um, I actually I think you know but I had some help, and I got on to the international management-training program? The theme- park tour? And – and – I was very into it? But I got sick. Out of – actually – out of Doderick’s eyeholes and—
Great. Excellent. Wonderful. Okay, give me some room? Connor, Primo! How are you?
Good. Excellent, Pa. Here you go.
Roman, Romulus! Look at you, you look fantastic!
Happy birthday, Dad.
Siobhan. Sweetheart. Is Tom here?
Uh-huh. Yup.
Oh well, never mind. This is Craig, everyone, by the way. Cousin Craig.
‘Craig’? It’s Greg. No?
Yeah. Greg. Greg. People have mistakenly called me Craig in the past so I answer to both.
Here. It’s just a token of my very real and enduring admiration and the hope that a new dawn might—
Kendall? You came.
Hey. Big day. Congratulations. You bastard.
Congratulations. Good luck.
So, what’s the news?
Okay. I’m just gonna—?
Okay, we’re good. Talk to me— Is there word? You’re on speakerphone.
PPG Bank have got their nose in, might be rustling up another bid.
Ugh. Shit on my dick.
O-kay! Now the fucking’s started!   you’re getting fucked!
I’ll call you back. Just a few final issues with the acquisition.
PPG are balls deep in him. Hustling up a rival bid.
Okay!?
It’s under control.
You know, I think the only thing worse for us than buying that piece of shit would be trying and losing.
Fuck off.
Well that’s unnecessary!
You want the rival bid to go away? Banks are whores. Pay them and they’ll fuck anything. So cut them in on our financing and—
Well, no because, there are rules—
Yeah the rules are for the – the people who like rules—
Are you getting played, Ken?
Am I getting played? No I’m not getting played. I’m the puppet master. I’m all over this, like fucking – mayo. Now look, can we please clear the room please? Thank you. I’ll be out, yeah? Thanks, guys. Great input.
People need to know you’re the boss, Ken?
Uh-huh. I know it.
This is your day. And not because he said eighty was retirement in some interview ten years ago. Because you deserve it. You did the MBA, you did the hard yards. China. But you might just need to push it over the finish line?
I’m not losing this deal. We call PPG, offer to cut them in on the financing, if they make the other bid fuck off. Okay? It’s Logan’s idea.
Great idea, Ken. Right idea.
Thank you. You are able to do anything. You are a master of the seas. If your final destination has been correctly determined, then all apparent diversions are but waymarkers of your route.
So, I brought you this. Happy birthday.
Oh. Thank you. This is? These are nice. These are nice houses – where is that?
That’s Vancouver?
I like Vancouver.
That’s our old house, Dad. These are all our old houses? LA, yeah? Montreal. London?
Wow. The paper is very thick.
Yeah. You like it?
Oh sure. Great. This is— a quality item. I want to look at this properly later. So, go on, give me five. What’s the news. What’s happening?
Good. Yeah. I want to talk to you about Tom. He thinks maybe he might be ready for the parks, you know globally and—
Look, Dad, we should get this somewhere ambient. You want to—?
Connor. How you going? How’s the ranch?
Perfect. Light pollution is like zero so, that’s nice, you know.
Wonderful. What the hell is it?
It’s a – goo? Is it goo?
Perfect.
Sourdough starter.
.
I thought you might enjoy making something?
Uh-huh? Right?
Fine. Forget it. I just thought you might like it?
I do. I just don’t know what the fuck it is.
It’s sourdough starter. To make bread, without yeast? The old way?
Oh, okay. Old bread. Thank you. How are we looking?
I’ll keep you posted. Look, Dad, I just checked with Frank and the holidays mean the board might be hard to get together and it’s all over the web, so I’ve scheduled a call for four? Then we can issue the release?
Uh-huh. You did?
Yeah. Is that okay?
You go on. I’m not going.
Sorry we’re late.
No worries. You’re not even. Twenty is margin of error.
And I got your message. That’s fine.
Yeah? It’s just as it all goes through – next two weekends will be crazy. But then – once it’s done, it would be great if—
It’s fine. Bank the weekends – spend them later.
I don’t want to fuck things up though. I can come up to you? And then – if you want we could grab dinner for the handover?
What like – two weekends. Ummm?
No? . Are you seeing someone?
Yeah. I am. And I’m just hoping this one won’t leave coke smeared all over the kids’ iPads?
Uh-huh. No. Fine. Yeah.
Kendall, it’s okay. I’m fucking around. You’re good. Coronation day. You deserve it. Seriously. After everything. And I think you’re going to be able to cope with this.
Well, obviously I’m going to be able to cope with this.
Exactly. I know.
Are we okay? Lunch in ten.
Hey, okay, listen, just two minutes before lunch? Kids. Can I get you, for two minutes?
Oooh a speech!
Er Uncle Logan could I get—?
Not now.
Sorry. I need your attention. About the— What I was saying, about the management-training program? I need to get back in.
You’re out?
Yeah. I got, there was an issue – and so my grandfather said to come and talk and—
I’ll do anything for my brother.
Oh that’s – that’s nice and, I’m really going to give this one hundred percent and I would love to be able to move up and—
He just needs to ask.
Oh. My grandfather? Right? I think he doesn’t like to— I mean you two don’t, talk so much, right?
Anything. Just get him to ask me.
Uh-huh. Hm. Right.
He wants some sourdough tips!
Hey. It was just an idea. What did you get him anyway?
Money.
Dude, he’s gonna love it. He can let it rise while he does his yoga?
Dad – are we—?
What’s the deal?
Er – yeah. So. . On the family trust, that will decide the situation in the event of my unlikely demise. I’m going to add Marcia to myself and you four.
Whoa? Okay?
With my seat also to go to her on my death—
What, which would give her, double voting weight?
Uh-huh. So I’ve got the paperwork for—
What so, Marcia will have two votes when you—?
 he—
Well no, Rome, it’s not an if?

Well it doesn’t matter what we want in this case, Rome?
Kendall’s already signed up but if I can get you all to—
Two? Two votes. I don’t think I was aware of that when I—
Read the small print, asshole!
This looks— I mean, yeah. But, I might need to talk to— You know, for all the implications?
Of course.
Just to get the full picture?
Sure. Take a beat. But look, I love the bread – goo and the picture book, but this is the present I really want? So by four, good? And also, I just mentioned this to Kendall, but despite the chatter, and all things considered I’m going to give it a couple of years.
As in?
I’ll stay in situ. As Chairman, CEO and head of the firm.
Dad, you what?
Well I just said, son, or were you not listening as usual?
But – I’m, you’re not—  ??
No big deal. I’m just staying on. We can discuss the details.
You   tell me.
We can announce you’re in pole position. Pending events. A move up or some—
‘Pending events’?
Okay, lunch! C’mon.
Dad?
Oh fuck!!
Well I don’t know what you’re fucking laughing about!
I’m not even laughing – what?
What the fuck? This is – this is going to be a shitstorm. He’s going to blow the firm’s credibility. Did he look okay by you?
Oh come on! Ken. This is typical.
I’m out – okay, I’m not playing. Whatever you three say – goes. Goodbye!
Con!
On the trust, I refuse to play. I don’t want to engage. I’m water, I just flow.
This doesn’t stand, right? Oh fucking  , you’re fucking   me …  ? Are you messaging? What are you …
Hey! What the fuck? Off the cloth, moth! Private! We’re not fourteen, dude!
What are you—? Are you telling? This stays in here. This is a lockdown—
We all need advice, man—
Advice – what? You’re gonna give a double vote to a power-hungry maniac who will do   with it because she’s got our dad’s dick in some super-max pussy grip and she’s juicing him before he croaks—!
Oh, dude, come on—
Um, guys? Lunch is coming up—
Sure thing.
Sorry, guys, I know you don’t get to see each other much but we’re nearly—?
No fine, thanks, apologies—
Not at all. It’s do as you please here. It’s not like we’re in a maximum-security penitentiary.
Hey. So you’ve fucked me?
I changed my mind, Kendall—
When? When  ? Cos it feels like you fucked me.
I had doubts and then certain things caused me to rethink.
When? Like what? This is—
It’s me. It’s mainly me. But you – you’re still— Three years ago you were still in the nuthouse.

It’s all good. I’m just worried – you might be soft, as yet.
Are you kidding? I’m battle-hardened. Fucking year in Shanghai.
I hear the guy from the website trash-talked you and you let him just come?
Not a website. And I was being professional!
I hear it played weak. Conflict-averse.
I wasn’t about to get into a fucking big-dick competition.
I hear you bent for him.
What?
I hear you bent for him and he fucked you?
Well, no.
Thing is, you’ve probably read a lot of books about management technique and this and that but you know what?
What?
Sometimes it is a big-dick competition.
That’s it is it? I should have shouted at some guy? But I didn’t? So you’ve ripped up eighteen months of corporate strategy?
And you never lawyered the trust change.
Oh, I   my father. That’s a black mark?
It’s an – an accumulation. You left the room. The deal.
To come to my dad’s fucking birthday party? We don’t know how many more there’ll be! So come on. When will you be ready? To step down?
I don’t know – five?
Five  ?!
Ten?
Ten!! Dad? Seriously?
It’s my fucking company.
Yeah and you’re running it into the ground. You spend all your time on costs – where’s the vision? You’re off the beat. Where’s the growth? All our graphs go down. All of them.
That’s why you’re paying a billion dollars for a gay little website?
It is   a fucking  ! It’s a portfolio of online brands and digital video content and it’s part of a strategy to save us if you’ll just let me —
Do you want to hit me, is that it?
For fuck’s sake.
Are you going to cry?
You know I’ve been floated already? There’s fucking paps outside. I’m getting asked for quotes?
Fuck them.
Yeah, course, ‘fuck them’. Great media strategy, Dad, great business strategy. When the Street hears, when the board hears?   sold a very promising digital platform for buttons. You just fucking missed it, okay? Fine. Everyone misses things. But you gotta let me get our beak in. The world is—
Yeah yeah. Everything changes. The studio was gonna tank when I bought it, everyone was gonna stay home with videotapes, then guess what – no, they wanna go out. Everyone told me no one wanted to watch network, except you make it zing and they do. You make your own reality. But once you’ve done it, then, apparently, everyone’s of the opinion, it was all fucking obvious? Lunch!!
Um, that was delicious.
Thank you.
Not at all.
No, absolutely fantastic. The whole day. So thoughtful.
Suck-up. ‘Gee you’re so great, Double-Vote-Power Mom!’
Fuck you.
And Greg, how’s your mom?
Oh good. I mean she can play the – the – nut-crusher, but she’s  great.
Oh that’s good. That is good.
Okay. Thank you very much. Now, when we’re done. It’s time for the game.
We’re playing the game?
Well, it’s my birthday so yes we’re playing the game!
You okay, Greg?
Sure – I’m not …
Wanna jump in with Frank or Connor?
Um. I think— Is there room in there?
I’m sorry if it’s a crush?
S’fine.
Yeah, I was just talking. To your brother? Grandpa.
Uh-huh.
He said, ‘Happy birthday’.
Did he?
Well. No. I guess. Not. But he is aware it’s your birthday.
Uh-huh.
But it occurred to me. Talking to him, and Mom, that having him with his seat on the – on the holding company, still, from historically. That must be suboptimal, in some ways? But if I could – if he was willing to give his seat, eventually, to someone more – perspicacious. Who could learn the ropes, running say a theme park. Would that, maybe, be a win-win?
Running parks?
Just learning. Just a little guy. Initially. Could that be—? You scratch my back … I wouldn’t say I could scratch yours. It’s too considerable. But – you scratch my back, I you know, not suck your— But. Is there an angle there perhaps?
 … I don’t like Lefty.
Which?
Lefty.
Lefty? Yeah? He’s – he’s a trusted— You’ve had him before?
I don’t want him flying me.
Uh-huh?
He’s safe, I’m sure. But we had that bumpy touchdown on the Vineyard? He looks like a prick.
Not a problem – do you want me to – let him go?
He’s fine. Just—
You go Righty. Who shall I send in Lefty?
I don’t— Greg or Connor and—? It’s fine. You decide. did
Can we go? What’s going on, Colin?
Just jump into that bird, Shiv, thank you!
So what you thinking, son? . On the thing? She’s really smart. She’d make good picks. Family first.
Oh sure. I’m sure.
So?
So? Well, you know. I guess, I want to do anything for you. . But—
But, where’s your cut?
No. God no. It’s your firm, Dad. It’s not ‘what’s in it for me’. But you know, what   in it for me?
I would love to get you back in?
Sure. Sure. It was just tough last time.   tough, with Frank over me, in LA.
Frank is important to the firm.
Oh sure. I understand. It’s just, at the studio I had ideas, I’m quite an innovative thinker, but I found a certain amount of resistance?
Is this still the film thing?
No, what?  ? It’s not about one great idea. It was a culture. I think he was maybe threatened by my energy?
So what would be your dream outfit?
Oh, I don’t know. You know me, I think we should liquidate. Financialize. Who wants pipes and product. When you can float hot with pure cash?
Uh-huh.
But if not. I’d wanna run the show. But, till that opened up. Chief Operating Officer. But I guess, that’s Frank?
Uh-huh.  
How you feeling. We good?
Yep, sure. I’m not totally against Marcia as a concept. And you know Tom would love to oversee the parks? He’d be good?
He would? Okay … And for you. If things are getting shaken up, would you come inside?
Dad, I’m not just playing with the politics.
No sure. Politics. Politics. Shiv, not to be crude, sweetheart, but politics is what comes out the asshole. Wouldn’t you like to be up front, feeding the horse?
My guy, he’s got that Airforce One look.  So to come back, I’d want the top job.
And if that was difficult? Overseeing everything outside the US – parks and all?
What, me Tom’s boss?
Yeah? Stepping stones.
What’s the long-lost cousin sniffing around for?
Oh he screwed up. Needs help.
Are you gonna sprinkle some sugar in his bowl?
I like him.
You like him?
Kind of. He’s scratchy. Hungry. I think he might fit at the parks eventually? Could Tom handle competition?
Yeah so – just wanted to give this to you. And say ‘happy birthday’.
Thanks.
Yeah it’s just a Patek Philippe. So. It’s incredibly accurate. Every time you look at it, it tells you exactly how rich you are.
That’s everything I look at, Tom.
My lawyer says it needs to be simple majority.
Same. So what are you thinking?
Well – starting position is – I’m diluting my power and that’s, probably a no, right?
Absolutely. My thing would be, why would we do this? Shiv’s saying she’s for no, on Marcia?
Well – no, I said— That’s my   position.
Oh, I thought—
It depends.
Uh-huh, it   depend.
How does it depend?
What the final situation is?
Plus, do you want to tell Dad no?
That’s not a big deal.
Yeah?? You’ll stick the bottle brush up the Lion King’s butthole?
As a group, we could just— Sure. I’d cram that shit right up.
He’ll put a kebab skewer through your eyeball.
Look my thing is – maybe it’s a package. Here’s the deal: we say no – all of us on the trust, full block. We say: stability. Stick to the plan. I take over – and we just – you two, under me – co-presidents?
Under you?
Uh-huh. But three. The power of three?
Interesting.
Can we think about it?
Of course—
Yeah I thought about it, fuck you!
So I hear you’re the new kid?
Oh well I only just started to get into the business I’m not even—
I’ve got my eye on you. You need any help, advice— just, you know— . don’t fucking bother okay? Are you tripping?
Right? As in?
I’m only razzing you, cuz! You’re dreaming! Relax. Pals, yeah? Would you kiss me, if I asked you? If I told you to?
Kiss you? I don’t …
Your face! Haha! Fuck me, man. That was an expression. Pals!
Oh – okay. Apologies. Hold it. Uh-huh. Uh-huh. Okay. Okay. I’m out of here. It’s the crunch. Frank, will you be linkman here? Dad, can I—
Of course. Everything okay?
If Kendall’s going we need one more to make it fair!  You wanna?
Sure?
C’mon. You’re up. Relax. Can you hit a ball? Cos I’ll give you a million dollars if you hit a home run, kid. I don’t know why you’re smiling. Seriously. A million.
Hey, I’ll do it for a million! I’m kidding – you’re good.
Grace, where’s my—
Rome?
Oh you don’t want him incentivized! One million dollars for a home run.
Okay. We okay?  – 
Ah, man. You choked! You choked it! Still you tried. Here’s quarter of a million!
Yeah – hey it’s just background for the story I heard you had cooking? Yeah I know Kendall Roy. And he’s saying Logan’s lost it. Kendall loves him but he’s slowing down. Making bad calls. Some major shareholders are worried. That’s what I’m hearing from people close to the family— those disloyal fucks.
Hey. Lawrence. Sorry the other offer evaporated. But we fattened the goose nice now, right?
I hear it’s a decent package.
The number is one-forty. Cash with a stock alternative. You’re on our board. Take the stock and you’ll own a nice piece of us. Rockstar salary.
Well that is an appealing package.
It is, yeah. It’s appealing.
You better play nice though. Because I’m the whole company.
No. You’re OFM. One Fungible Motherfucker. You think you’re so fucking hip but all I want is the brand. The whole firm is just so much fairy dust. It just happens I want some today.
Well we’ll see if I choose to—
Yeah I think you’re going to stick around. I’m going to stuff your mouth with so much gold. Non-disclosure agreement. Non-compete. I’m going to lock you in a golden cage, fuck you with a silver dildo and pay you so much you sing whatever song I want.
Easy. You still need me to recommend this or—
No, this is a deal so fucking good you have to take it, or we’ll see you in court.
You wanted five?
Yeah. Frank. I’ve been thinking if now isn’t a time for a new role for you?
Okay? As in. What sort of—?
Light duties.
‘Light duties’? Are you kidding? Logan. Me?
No one has as much respect as me for you, Frank—
Oh no. No, c’mon, fuck this—
It’s a step up. The press release should be on your phone. Just proof it. You might want to add some color, it’s quite dry.
That’s it? To  Here? You are what you do, Logan. You know that? In the end you’re just what you do.
Yeah well, you’ll get your nut. Hey, kids?
So. What you say, kids?
What’s the Frank situation?
Frank’s out of the picture.
Yeah? Fuck.
Frank’s dead. Tom should be stepping up. Shiv’s thinking about a new role. So, are we good?
Um? Shiv?
Rome?
Um? Con?
I’m with these two. What they say goes.
Our position is that this doesn’t quite work for us. At present.
You what?
It’s not sufficiently attractive. As a proposition.
Are you fucking joking?
We get that. We do. We’d like to help. I’d love to help.
Then help.
But – why would I? When— I mean— Giving   power. Why would I do that? —
Dad? It’s just a first position?
Dad? Dad.
Dad!
Dad?
Take us— Get us to a hospital.
Dad? Are you—?
What’s Dad—? Are you—?
Uh-huh. Uh-huh. Uh-huh. Thank you. Kendall? You heard?
What?
Deal. It’s very exciting. I can’t wait to join your board.
I think you’ve made a great decision and I hope there’s no hard feelings over all the cock-jousting.
Nuh-huh. You win.
 yes!
Your dad just had a brain hemorrhage.
What?
I’m sorry. I’m sorry for you.
Are you? Is this—?
But you just invited me into your chicken coop. And I’m going to eat you all. One by fucking one.
Hello?
We’ve got an eighty-year-old male, found with LOC. Vitals are BP one-ninety over one-oh-two, pulse at ninety-four. Respiration at twelve. Patient only responsive to pain is on high-con O2 at fifteen- LPM. He’s unstable. I’ve spoken to the daughter, she can’t tell me what meds he’s on.
Why aren’t we moving? Why the fuck aren’t we moving?
We’re in traffic. We’ll get there.
Still unresponsive. Take eight vials and get them to the lab.
How long, how long does the satnav say? Which app is that? Cross-check, cross-check Waze and Google Maps and Apple Maps. I don’t care about the traffic! Make it. Let’s make it. Let’s weave, man. This is my father. Middle lane! My father’s dying, let’s get me there, let’s do it. Roman? What? Is he okay? Stop crying, buddy. Please. I can’t understand anything you’re saying, man. Seriously. You’re going to make me cry. I’m there, I’m nearly there. I’ll be there now, man, okay? Hang tight. I love you. Tell Dad I love him. Okay? Oh fuck. Oh fuck. We need – we need. I don’t know what we need.
Ken, we’ll be there. We’ll get there. You can’t park there.
Talk to him. My dad might be dying!
Hey. Are you okay? Do we know anything? Are you okay?
Yeah. No. Yeah.
What can I do to make this better? Tea? Call your mom?
No.
Shiv, I’m human Siri, task me.
Um, tell Sarah to get Dad’s doctor. And research the best neurologists.
I will action that.
Maybe I should? I should go through my diary with her, clear it out, and you won’t know what’s important …
Hey. I’m doing it. I’ve done it. It’s already happened. Forget it.
Sorry, you need to be in the waiting area.
What were you and Marcia saying?
What?
You were just – you were looking at me and talking?
She said, ‘You’re my favorite, don’t tell Shiv.’ What do you think? She asked what happened. So I told her.
It will be okay, I promise. I’m here.
Thanks, big man. Huge relief.
Hey come on? Just saying, lean on me.
Hey. Where are we at? How is he?
I’m sorry, we need this area clear.
I just arrived? I don’t know where to stand, okay? Show me where to stand and I’ll stand there.
Wise elders, Ken. These people do an incredible job.
Fuck. What’s the situation? Do we need to call anyone? What is this – part of the hospital, is this the best – section?
Excuse me, are we in the best part of the hospital? Sorry – but we need to—
The ICU is the ICU. This is the best place for him.
I told the staff to take Rava and Grace and the kids away, and bring them in later, yes?
Should the kids see this?
It’s good. It’s the cycle of life.
Well he’s not dying.
Nobody said he was dying.
He did.
I’m sorry, could you give the team some space?
Here’s an idea. How about you worry about the medicine, not the fucking feng shui?
Can you give us a picture please, and we want to just check this is the highest care level available? Look. Do they know who we are? Do they know who he is?
Should we call Mom?
No. What? There’s a million people to call. And she’ll make it about her.
I think you should call. I mean, it’s not like she’ll come. Will she?
Folks. You need to wait through there—
Hey, I’m sorry, we’re getting mixed messages. We have no clue what’s going on.
We’ll be with you as soon as we have an assessment.",0.45489340854378846,0.5600228677575405,0.3480006054760172,0.33265820857710565,0.39292576416180686,0.3584176751283499,0.4060450180648611,0.2831092639038196,0.421683403226332,0.3454222362775069,0.15487555565240865,0.11064598690897513,0.21327715183679874,0.39921178166718724,0.3254485560511687,0.21512317687559587,0.24595569652961924,0.1739733350284111,0.07822054315911373
