part,script, 
8,"Oh, Dad? That’s— It’s insulting.
Alright. Gerri, you go. If you can’t do it fuck off! Just text on your phone, you bendy fuck.
Hey. You okay, kiddo?
What – that? Oh that’s nothing.
Uh-huh?
I got game. Sometimes you play possum. Let him punch it out till he gets tired. Then, I move in for the kill.
Right. Nice. So – I’ve been wanting to ask. How’s Kendall?
He blowing you off too? Last time I saw him he was smoking crank with some mole men. But that was, like, a month back. He’s hustling.
Right, VC-ing?
I’m maybe seeing him this weekend. If he shows.
Yeah?
Fuck. Dude. I don’t suppose you know a coke dealer in Prague?
Um. Probably. Why?
Tom Wom bachelor party. Ugh. Ugh. I don’t have time for this shit!
Tell you what, dude, fuck Prague. My girlfriend and her freak dogs they run – you know these parties? Rhomboid?
Bullshit. Rhomboid?
Hey, I’m cool.
Please. Because you have a nipple ring and simply will   stop going on about it?
Better than telling everyone you’re ‘down with Dre’ because he sends you cereal bars at Christmas.
Fuck you, I have a reputation. I’m not taking my crew to watch, some art pricks and some tech hoes dance around in bowler hats and twizzle their mustaches out of time to the ‘beatz’. Dude. Come on. Not the lumbar setting.
You know who else’ll be there? Sandy Furness.
Really? Yuch. He goes to those things?
I know, right? But he’s sitting on the other half of your dad’s dream deal. Packet of fifty more local stations. Come to the party. Talk him into selling. Go home to Zeus like a triumphant fucking Hermes or someone. Does that make sense? I never read any of that shit.
Sandy goes? Jesus.
Dude. Send me the names, I’ll get you on the list. And bring Kendall yeah, I need to straighten things out.
Bro? How about some more bass in the back? I like to feel my teeth dance.
You okay, Ken?
I’m good. And listen, try not to drag yourself in there like the world’s oldest man, yeah? And try not to breathe so loud. Kendall. Frank. This is Dust.
‘Hey.’ Great to connect. Love the name, by the way. Very funky.
Please excuse Captain fucking Bee-Bop here. How’s it going? Nice shirt. Big fan of what you do. Fucking sweet potatoes. Thank you. Um. Likewise? Angela. Did you want to spin us through the pitch deck?
I don’t need to hear the pitch. Because I’ve X-rayed your business and I get how it works. You buy bullshit from idiots and you sell it to pricks. Art-school student makes a painting, you jack up the price, skim it, sell it on. We’re interested in increasing the reach of young artists.  … and the democratization of art.
No absolutely, I get it. You’re giving a platform to marginalized talent. I’m just telling you how this works from the outside, to the sharks. Maybe we should talk about funding cycles—
Look. Can I tell you something? I bought these on my way over here because I thought you’d like them and I’m passionate about working with you. Don’t sell your soul to some monolith. We’re boutique, we’re light on our feet. Fucking rebel alliance. I’m a good guy, who knows the bad guys and I’ll fight for you every day. I’m the asshole who can be your Warhol. And yeah, I just thought of that. So what? Do I take off my shoes? I will. I’ll throw them out the fucking window right now.
What do you think? I mean I’m somewhat between the devil and the deep blue sea here because, my boss downstairs, is like waiting, and yet my boss up here is. Him. And I’ve been here three and a half hours now. Do you have any advice?
Ugh. It’s the wheel.
It’s buffering. You could try knocking it down to low quality? There will be a minor loss of crispness. Wow. That’s a lot of browser tabs. But, then, you’re a busy guy.
I hear you boys are headed out for Tom’s bachelor party?
Yes. That’s correct. Roman’s arranging. Prague has been mentioned?
 … Logan Roy is a pernicious influence on our culture, he is, to be frank, a cancer to American values …
Man. That guy. What a – jackhole. Well. He just lost my vote.
Huh.
Got a really good head of hair there. Sorry to— But it’s the maternal side I think, that’s carried on. So! Good news for me!
So listen. This party. Can you make sure Kendall doesn’t come home in a box?
Okay?
I don’t want him showing up dead at the bottom of some French fag’s swimming pool.
Absolutely. None of us do, sir.
Keep an eye on him for me. Is that something you can do for me?
Yes, sir. In which case would now be a convenient time to talk with you about my position, because I’d like to move on from parks and into, for example, digital? I won’t mention any names but there’s a culture of— It can border on the personally abusive.
Tom? Tom can dish it out?
He’s pretty able in that department. All I’m doing is, I’m flagging to you that I’m thirsty for the next chapter.
Take care of this for me, perhaps we’ll talk.
Muchly appreciated. ‘ ’?
 … and it’s a wave, a wave that pushes up. It starts with the voters like you. And it rises and breaks over the powerful and says,  is where it starts. And today we’re calling time’s up. Time’s up on the big media owners who pervert the flow of true, pure, information. Contaminate it with their sour and bitter pollutants. Time’s up for Waystar Royco, and the shadow it casts across our national conversation. Time’s up for the man at the top of that pyramid – Logan Roy. The man who, it seems, will not rest until he has monopolized the provision of news in these United States.
You saw this?
ATN spot. Uh-huh. Yeah. I guess, we do? Right.
You’re going to stand right there? In my air space?
I am rereading for context.
You’re cc’d.
I can’t believe I get paid to call my dad names. It’s so cathartic.
You really think he should do ATN?
Sure. Into the lion’s den. He attacks them, righteous, Old Testament anti-capitalist Gil. They attack us, ‘there’s a red in the bed!’ No one’s mind’s getting changed. We get the base fired up. They get the viewers. Then, once we’re through the primaries, we pivot to center.
Gil won’t pivot.
I’ll get him to pivot. Hello?
So listen, something’s afoot. I’ve arrived at the drop-off point and it seems there’s been a change of plan— I’m pretty sure I’m being pranked.
What’s happening, Roman?
Just – hold your tingling wieners. All will become clear.
I’m not sure you understand how disruptive it is to be changing the itinerary at this late stage—
And I don’t know what’s going to happen but – you know, I have a feeling it’s all liable to get a little ‘disgusting’ and—
Pretty sure you’re not supposed to be telling me this, Tom?
I just wanted to flag it. And calm the qualms. Because I for one—
Tom. We’re adults. It’s one night. Enjoy yourself.
Shiv …  ? Honey badger?   I want to dock myself inside you so much right now.
I love you too, Tom.
Oh, okay.   he deigns to join us. You’re late.
Yeah well. Apologies. I’ve been a little busy revolutionizing tech financing.
 … On coke.
Okay, what is this, Roman?
Alright! Who wants to fuck a hobo? No? Then let’s roll out. Party. Down there.
Wait, what? We’re going to a party in a tunnel?
Relax. We’re not going to a party in the tunnel. It’s a ruse.
What is this? Some pop-up shit?
Am I going to need my central Europe coat?
Rome, what now? I’m wearing flight socks and my TSA slip-ons. C’mon!
I get what’s happening here. One minute I’m getting lured into a tunnel, next thing I wake up in Belgium with no eyebrows.
You should probably dump your luggage in the car. And listen, I’m really sorry, guys – but it’s a pretty tight guest list?
Oh. Roman, what? Matt and Jonas? The Fly Guys aren’t …? They flew in. The old team? Roman?
Relax, we’ll figure it out. Keep your phones on, we’ll first-wave it and call you once we’re inside. Take twenty for coffee.
Thanks.
I can buy a coffee.
Gah. Oh! I can’t leave Team Fly Guy. That’s the Fly Guy code? Keep your phones on yeah? I’ll call you! Five minutes. Five.
Oh, man. What the fuck have you got planned for me, Roman? Seriously. What have you got planned?
Look. Tom, I’m sorry. Prague fell through and I was busy and I didn’t have time to organize a – hot-air balloon to Monaco.
Okay … ‘Hot-air balloon …’?
I just stepped on a snail. Oh god. I hate stepping on snails.
Roman, do you know where you’re going?
Yeah. I came to another thing here.
Ugh. This is a disaster on the footware front. Can I change? Guys? Stop for a shoe change?
You kept your luggage?
Be prepared. I know Roman. And I love him. But I don’t trust him. He’s a twenty-four-karat dingbat.
So, bro. Are you going to be okay to be around all the booze and coke? Because, I can make sure no one does it around you, man.
I’ll be fine, man. Thank you.
I hear you’re ‘doing apps’.
Uh-huh. I’m incubating. I’ve been out on the west coast sprinkling fuck-dust. Rebalancing away from crypto, into eco.
Wow. It’s all so futuristico.
Better than being carried around in Dad’s pockets like fucking Stuart Little—
Hey. They’re nice pockets. Spacious.
How is he? Still using your fragile self-esteem as a punchbag?
He’s actually got me overseeing this satellite launch out of Tanegashima.
Wow. A spaceship?
Plus I’m heading up the local deal. Bob Galpin’s selling and I knocked it out the park. Which was nice.
Good for you, bro.
Guess I finally broke out the cage. ‘Can’t keep a good dog down,’ right, bro? Okay! Abandon all hope, ye who enter!
Is this real? Is this a real corridor? Are we at an airfield?
Yeah Willa moved out to Austerlitz. And she loves it. She loves how quiet it is. She didn’t think she would but she really does. So. Girlfriend. I guess I for one won’t be partaking in any debauchery. Roman Roy and guests? Welcome to Rhomboid.
Okay, boys, we’re pouching.
Wait – how are we going to phone the Fly Guys?
Tom, we’ll figure it out. I think the big white men are going to be drinking   of diner coffee. What’s in the luggage, sir?
It’s a variety of winter wear. You can leave that with us.
Okay so this way …
Wait … So this is it …? This is   where I’m going for my bachelor party?
It smells of – ammonia. And, like, the inside of handbags? If you’re at all familiar with that smell?
The tough thing is I’ve been living on central European time for forty- eight hours, to ease the transition. So I’ll be ready for breakfast soon.
It doesn’t look like the sort of party with a lot of food?
Roman. I’m sorry – am I having my bachelor party in a very large, very cold sort of – pretend rail yard?
Hey, Rome. Ken?! How you going?!
Stewy?
Bro. Long time. You look like shit. What you up to, working at Starbucks and growing the coverage? We good?
You’re my third oldest friend and you fucked me like a tied goat. We’re great.
Let me show you up.
Oh and Kendall. If you need anything this evening. Bottle of water, soft drink – I’m more than happy to be your mule on the whole soft- beverage side of things? Okay?
So, dude, where’s Sandy? When do we sit?
All things in time.
No. I’m sure it’ll be great. Thanks, Roman.
What did you expect? Why did you even ask me, Tom?
I thought you’d rise to the occasion.
Well clearly I haven’t risen to the occasion.
One second – Kendall, I’ll find you.
Okay. This is it. Yeah? Cool right? Is it cool? Or is it like total fucking bullshit? Who knows?
What is this?
It’s a physical fun palace. It’s if you like it and she likes it, it’s all good. Uh, this guy – look at the fucking bird mask like it’s  .
Wait –  — Is this – gonna be an orgy?
No.
It’s not gonna be an orgy?
Greg. It’s not 1997. It’s not this and it’s not that. Don’t be so binary, Mr Betamax.
So it’s – it’s a bit of an orgy?
It’s basically a collective of hot people – and Connor. At a party. With a monkey dressed as an astronaut. It’s whatever you want it to be. It’s a fucking – sandpit for emergent behaviors.
Okay! Okay. Holy shit. So can we, are we going to be able to – fuck here?
Not me, business is my fucking.
Sure. Maybe we could find you a Bloomberg terminal to stick your cock in?
Well, I’m out. In a relationship. Girlfriend!
Well I have to say, Roman. This is promising! This is very promising!
See, Tom? How about a little faith?
But there’s areas though? Neutral areas? It’s not— In the sense of it being compulsory.
Angela? Dust? Yeah? Hey? Oh – fuck? Hey. What’s happening?
We just got here. Cool. Very cool. Totally. Same. This is actually only like the third time I ever did this, so.
This must be synchronicity, huh? Two people meet in a warehouse and the fucking world changes? Oh. Yeah. And we really appreciated you coming to see us—
I’m super-excited. Oh. Totally. Me too.
Well, you have a great night, Angela.
So maybe – one water, one wine? As a kind of informal rule for the group? Plus, they have risotto balls?! Soakers. Super-soakers.
Can I help you with something, Greg?
Man. It is going off tonight like Wambs, gans, thank you ma’ams! We should go talk to some girls.
Little tip. Ask them where they were on 9/11. If they can’t remember, they could be under twenty-one.
Shiv gave me a hall pass. ‘We’re adults.’ Apparently. I’m going to blow my stack, like, multiple times!
And what, Shiv? Shiv has the same arrangement. She’s an adult too?
What? No! I mean. Sure. I – I don’t know. Greg, it’s not a competition.
No, it’s cool. I’m sure you’ve got it all figured out.
What’s this?
Molly. Happy pills. Con man. C’mon. No?
What? Prague time. It’s two in the morning for me. I need a pick-me- up. Dude, I know my way round. 1986. Me and a Fleetwood Mac LP and a bag of weed touched the face of God! First of the evening! First of many!
Connor. Do not do any more of these.
Got it. I am one and done.
So. How does it feel to be out?
Not going to lie. Great. Seeing the kids. Growing kale. Following my nose. Intrigued by vegan meat.
And about the vote and your dad, you know I had to follow the money, right?
I get it. Friends are friends but money’s money.
Exactly. And, listen. Here’s a question. How would you feel about getting all the way out? Half a bil for your share of Waystar.
Hello?
I know. I’m feeling generous. I’ve plumped the pillows, added a little premium. Can you get me one of these but without any of this? Thank you, I’ll be right here.
Consisting of what?
Straight liquid.
Bullshit.
Don’t worry about that. I can raise it.
Why would you want to be even more in? The place is a fucking antique shop.
Ken. Just take the money and get out.
Well. It’s not uninteresting. Because I’ve got a lot cooking. An artificial sun. Clean beef made in the lab.
Great. So listen. Part two. How would you feel about talking about this with Sandy?
Sandy Furness? Excuse me, what the fuck?
These bathrobes are nice. You should ask for these.
Uh-huh.
What’s your table-linen philosophy?
My philosophy is I literally don’t give a fuck. So what’s that, Nietzsche?
Silverware. These are what we have on our registry. You should go for these.
You want us to have matching cutlery?
Why not? It’d be sort of horrible and cute.
Right what and then when we get divorced and split all the stuff, we can hook up and still have the full set?
Uh-huh.
You know this is just fun, right?
I know. This is just—
Nothing. I mean there’s no God, and there’s no – anything. So there’s just people, trying to be happy, in rooms. Right?
Right.
And you know I’m suggesting to Gil, on ATN, he cools off on the anti-Waystar agenda.
Er. Excuse me?
I talked to him after the thing.
Oh. Okay, well, I have spent quite some time on how it would be ‘very vivid’ to attack Waystar on a Waystar network.
It’s played out. It looks like we have an agenda.
Er, we do. Stopping overly mighty media owners setting the agenda for our democracy. DOJ, FCC, Batman to stop your dad eating the news.
Uh-huh? Even if we’re going for that, isn’t it in a big important speech nobody reads? Tonight he can forget the base and connect with America.
Shiv, I appreciate you might have split loyalties on this—
Fuck you. I just want him to win.
I’m just not sure he can do both at once. The base, and the rest.
If you can’t ride two horses at once, you shouldn’t be working at the circus.
Sandy comes to these things?
Oh yeah. The thing about Sandy? He   sex. I know. Gross. He takes the thing that he pees through and he puts it into other people. It’s disgusting.
Kendall. You look well.
Thank you. You look – incredibly out of place. So. You wanted to talk?
Has Stewy filled you in …  ?
Why do I feel like I’m about to find out you’re not my real mommy and daddy after all?
Look, the truth is he wants your piece of pie, but – and I don’t want you to blow a fuse, but he’s already in on Waystar.
As in?
Sandy’s me, I’m Sandy. We’re kind of a single entity. Like a creature from mythology. Head of a horse, dick of a swan.
Seriously? Stewy? Jesus Christ.
I have a shell company attached to his private equity fund. I’m a parasite on a parasite.
You obviously should have disclosed this to me when I brought you in. You acted like kind of a snake?
And you acted like kind of a sap, so, quits?
You were in a tough position without having to consider whether your dad would want me … involved.
He very much would not.
So apparently my girlfriend’s having a panic attack – so I’m going to let you two catch up.
Stewy tells me you’re getting into tech.
I have a fund. We’re small but we’re engaged. Only work with good people. I’m interested in adopting an ethical posture.
Half a billion. Smart guy could make a pretty big difference …
Just closed a deal tonight. Also there’s these four Stanford grads, they have a piece of proprietary tech, it’s a cluster of hydrogen lamps in a honeycomb formation and it makes a kind of artificial sun—
Wait. What’s going on …? Dude. Are you pitching? Did you just pitch?
Where’d you spring from, Heidi?
Don’t stop. I want to hear the big pitch. I might invest.
We were just talking.
To him? The enemy? Dude? He’s doing apps now. Did he say? He has this dry-cleaning one. It’s going to revolutionize the way we get grease spots out of ‘chinos’.
Rome? The adults are talking. How about you go play in the other room?
Sandy, could we maybe get a moment in private? Because I’d like to talk to you about how attached you’re feeling to your fifty failing local TV stations?
Sure. I’m sure we can find a time …
Roman. Could you maybe back off for like twenty minutes?
I’m good thanks, Kendall.
Maybe just dial it in like  . Get us a drink.
Haha. No.
I would love another old fashioned.
Look I know you and my dad are deeply and happily in hate and have been for many years – but I need you to know, I’m my own thing. And I’m fully authorized to negotiate on Logan’s behalf.
‘Logan’.
I’m actually overseeing telecoms.
He’s doing satellites like it’s 1985. Dad’s got him holding the plastic wheel in the back and telling him he’s driving.
You’ll have to excuse my brother, he’s making some adjustments right now and he’s a little ‘off-center’.
How about you fuck off back to your little gangbang?
You see this? How he talks to me?
You’re embarrassing yourself.
Family.
You know he used to lock me in a cage?
What the fuck?
Back when we were younger. True story. What? You pretending you don’t remember the Dog Pound?
You’re tripping.
It was a game, I had to climb into the big Alsatian cage in the kitchen and wait for someone to come collect me.
Oh yeah …? I don’t know—
Might be three minutes, might be the whole afternoon. Four years old. Eating dog food from a cold tin bowl.
You need to stop talking.
Pissed myself in there once. He just gave me some newssheet and told me to mop it up. I know, right? They should make a fucking movie about this shit.
Excuse me, I’ll be back.
What the fuck are you doing?
What?
What was that bullshit?
Oh, I can’t— I can say what I want.
Yeah but you— That was – that was insane.
You want me to pretend none of it happened?
What happened?
So none of that happened? The Dog Pound?
Okay. I never made you eat dog food.
There was a bowl and it was filled with chow and I had to stay in there until it was finished.
It was a game. You enjoyed it. Ask Connor, ask Shiv.
I enjoyed being in a cage for three hours with a leash around my neck. Sure.
So now there’s a leash. You’re full of shit.
That’s right, Kendall. Me.   the piece of shit. Enjoy the party, asshole.
Have you seen Kendall? Because I feel like we should maybe keep an eye on him?
—Austerlitz. It’s in New Mexico. And we recycle all our rainwater. Oh yeah? That’s awesome!
Hey Con, can I ask you something?
Roman this is Amy and she’s amazing. So smart. I really like her.
Dude? That’s the drugs talking.
No, I really don’t think it is. I think we have a real connection, you know?
Trust me, it’s the drugs.
It really isn’t. We’re just really relaxed in each other’s company. She held my hand. I think I’m in love.
For fuck’s sake, you’re not in love, man.
The only problem is I’m in love with Willa. So I can’t be in love with Amy and in love with Willa. I mean, Willa’s amazing and Amy’s amazing maybe we can all be amazing together.
Sure. On your Mormon sex ranch. Look, do you remember anything about the Dog Pound from growing up?
I remember something about a game you used to play.
So he did? He used to lock me in a cage?
Sure. The big cage. In the laundry room. At your mom’s place in Cheltenham.
Right? What a bastard.
No, you liked it. You used to ask to go in the cage.
What?
Yeah, it was weird but I think you enjoyed it.
Okay. So I ‘asked’ to eat dog food?
It was chocolate cake. I think?
Bullshit. Kendall locked me in a cage, I went all fucking weird, started pissing the bed and that’s why Dad sent me away to St Andrew’s.
Rome, Dad sent you away to military school because you saw  you started marching up and down the hallway with a placard saying, ‘Send me away to military school.’
You’re full of shit.
Well, that’s how I remember it. Seriously. It’s safe from biological and chemical attack and you’d all be welcome, pre- or post-apocalypse.
I’d like to unsheathe please. Go bareback.  –
Hello …  ? No, I’m happy with my current provider thank you.
I’m just checking in …
Tom, sweetheart, listen, I’m at ATN with Gil, what is the least number of syllables you think you can say this in?
Yeah, just so we’re clear – in terms of you and me. Is this a quid pro quo arrangement?
What are you talking about, Tom?
Because if I for instance, touch a boob, do you grab a dick?
Um. I don’t know if—
Is there a rough chart of comparison? Like Celsius to Fahrenheit? Or is it an eye for an eye, an orifice for an orifice? I’m just trying to get a sense of the parameters?
Tom. I can’t negotiate right now. Just— We know, right? We know.
Right. No sure, we know.
You want to run the tree on how personal stuff plays?
Issues. Issues issues issues. I can handle the soft soap, Shiv.
Hey, Kendall, just spoken to Shiv. Official permission for having of the fun!
Amazing. So happy for you.
Frank, so listen, I’ve had an approach. Very interesting approach and I wanted to get your brain on it—
I heard from the girls. The Dust thing. With the art?
I know. I saw them. It’s locked down.
They wanted you to know, they loved you in the room but …
Frank. I just spoke to the girl.
Ken. They’re already setting this up elsewhere. But like I say, they loved you in the room …
What are you talking about?
I think there’s other money and they like it better.
Then we match it.
I already tried. But seriously, they loved you in the room—
Stop telling me they loved me in the fucking room. Frank. Let me talk to her, I can fix this.
Can we talk for a second? Could we do this another time?
I just got off the phone to Frank. He told me. I’m sorry. It’s nothing personal—
Listen. And I shouldn’t be telling you this, but I’m about to land a chunk of seed capital the size of fucking – Idaho so whatever it is you need I can make it happen, okay? Okay.
Okay? We good? Yeah, it’s just, not about that.
Then? Help me out here. Because there’s something I’m not seeing— It’s the name.
Which – Dust? Roy. Kendall Roy. It’s like I was marrying Hitler and then what? I’d get to be – Mrs Hitler?
Okay. I get it. But that’s not me. I’m not a Roy. Not really. I’m sorry, it’s cool. We just don’t want to be ‘Hitler Incorporated’. You’re a—
I’m solid, I’m a good guy. Well consensus is you’re a coked-up prick who can’t shit straight. You think you’re different, you’re the same poison in new sneakers?
Angela. Okay. I’m going to be frank with you— Look. I didn’t want to do this here. And I may be being more forthright cos of the coke. I definitely seem to get more forthright on coke I’m sorry—
Hey, wait— Hey fuck off.
Hey, man, can I get in on that? I’m joined in the studio by Senator Gil Eavis. Firstly, Senator, welcome. We appreciate it.
Happy to be here, Sharon. Let’s jump straight in if we may? Your wife very tragically took her own life eighteen months ago.
The warmest of ATN welcomes.
Soft-core. Horrible but easy.
Um. I think everyone knows about that and it’s something I live with but isn’t relevant in terms of the issues I want to— The impression you’ve given is that it did inform your decision to run?
A lot of things inform a big decision like this. What I want to talk about is— It hasn’t been long and I guess what some people will ask is, what could possibly have caused such a tragedy and are you ready so suddenly to turn around and run for the highest office?
Doesn’t he have a line for this?
It’s normally – it’s normally good.
What I’m focussed on what I think this country needs to do— But it’s something you think about? Your mental and emotional state?
Yes. Sharon. I think about my feelings. Like most humans.
No. No jokes. Nate?
Yeah. I don’t know. Can we change channels on this? It must be incredibly difficult for you, especially someone who has had to deal with rumors swirling around the state of their mental health.
You know, instead of playing a pretend game of sympathy where you’re trying to get your viewers to ask: ‘What sort of guy has a wife who kills herself?’— That’s not what I said—
Maybe we should talk about the guy who owns this channel, your boss, the owner of ATN, who’s trying to buy up local news networks all over the country – so I’m calling for this deal to be blocked by the FCC, and for the DOJ to launch an in-depth investigation …
Is this okay?
I don’t— It doesn’t feel great? I’m going hot and cold so fast I think I might have hit the fucking menopause. Would you say your emotional outbursts here could suggest you’re not emotionally ready, temperamentally ready, to seek to lead the free world?
If you wanna make this personal let’s talk about Logan Roy. Your paymaster who has presumably sent you in as a hatchet woman? Oh come on.
Because you can tell a lot about someone from their relationship with their family.
Oh fuck.
I feel sick.
Then you should puke. We could use the distraction.
His only daughter has come to work for me. What does that tell you about the man? You’ve got a hot temper haven’t you, Gil Eavis? You don’t want to take any more questions, is that it?
They knew. They knew we were coming for them.
Okay, wait. No, Kendall …  ?
What is it with you and him? You’ve been up his ass all day. Are you trying to fuck him?
No I just – I just want to make sure—
Make sure what?
Roman – excuse me— It’s not anything.
Is something going on, Greg? Because I can see inside your brain. And if anything’s obscured. I’ll pull your fingers off.
If I say, you will keep it to yourself?
Yes.
You won’t tell him will you?
Absolutely not.
Okay. Your dad – I think he’s worried about him – he asked me to keep an eye on him?
Hey, Kendall! Dad asked Greg to keep an eye on you.
Wait – he’s been   on me?
He just – I think he was concerned.
Okay. Well. I’m about to do these four lines of coke and then my heart’s going to explode so if you want to stop me—
But that’s like— I don’t get involved in the white drugs.
Or maybe you want to explain to my dad how you let his son OD?
Come on …?
What are you gonna do, cuz? He’s counting on you, Greg. He’s counting on you to look after me.
Yeah go for it, Greg! Suck on those big white dicks, you fucking pervert! Holy shit, cuz! You greedy piece of shit!
And now I guess I have to go find some more.
That is – strong – drugs. I need to— Should I puke?
Unless you can puke up your bloodstream? Oh, man, I hope you don’t die! Cos if you do your heart’ll be pumping so hard it’ll probably bring you back to life and then you’re just in a vicious circle of dying and briefly reanimating! Buckle up, fucklehead!
Hello, Pinky. Glad you kept the date.
Well. Family. How was the play?
You know. People pretending to be people. How are the wedding preparations?
Very exciting.
Well I am excited. My daughter.
You saw the interview?
They told me.
You came after the man’s wife.
They said.
And you’re happy with that?
Well tell him not to speak about my family. Not on my network and not on any network, ever again, or I’ll end him.
So – silence the man who says you’re stifling dissent?
I’m a bad father? How dare he? He’s a bad husband. He killed his fucking wife.
What if your acquisitions are bad for the country?
Meh meh meh. Men change the world. Cowards complain. He’s using you. Can’t you see it? Don’t let a lot of bullshit overshadow the wedding okay?
The fucking wedding? I don’t care about—
C’mon, stop screwing around. Let’s talk. Come in. I’m tired of this. You have potential. I always thought you were the smartest.
So that’s why you tried Kendall and Roman first? You know what – I am the smartest. Which is why I can see through you and this transparent little offer to buy me off.
You know, I’ve always taken care of you, Siobhan, and maybe I shouldn’t have. Maybe I should just let them come for you.
Like what?
I hear things, Siobhan.
Okay. You know what, Dad? If this is the way things are going—
Well then I’m truly sorry.
—and in terms of Shiv, where I’ve landed is – I think I’m going to maybe just ask for a ‘handy’?
Tom. Don’t  rationalize. You get off and you eat the shame for dessert. Wait. Her? This one?
Yeah. We were talking for twenty minutes about financial derivatives and then she just asked me?
My god. Holy shit. Dad would go absolutely nuts for her. You should do it.
Yeah?
Man. I’d be all over her. I’d like— I’d fucking –  . Oh yeah.
Okay. I need a Smint. Do you have anything?
Tom. Just grab your baloney-pipe and jizz.
So is now a good time to sit down with the old geezer?
Soon. Did you see the projection with all the plastic in the Pacific?
So when can I talk to him? Because I would love to secure something to take home?
Romey. Be cool. Maybe eat a slider, ask if you can stick your finger in someone’s ass—
You know what – fuck you. I’m not your little pet that you get to kick around. You think I can’t make life difficult for you? Word in the right ear, I can be your migraine, motherfucker. I came here to talk to the old man. On your word. So make it happen.
Okay, okay.
I tried to hide but it finds you. Wherever you hide, the party finds you. Sir, this is your final warning.
Absolutely. Got it. Understood.
What’s happening? Your friend keeps telling people he’s in love with them. And it’s making people uncomfortable.
My bad. Mixed messages, we just share such strong feelings on gut bacteria I think I got the wrong end of the stick.
Oh my god, dude. That was 
Oh yeah?
Maybe I should go apologize …? Give her a hug …?
Me and this girl. Went into a side room. Made out for a while, I was touching her, she goes down on me, I just splooge in her mouth. I know! Then – get this – she kisses me, and puts it back into my mouth, I swallow.
Which – the splooge?
I know. So hot.
You swallowed your own load?
Because I’ve heard about it but I never knew it actually happened.
Oh yeah? Because I haven’t heard of it.
Yeah. There’s a word for it. I can’t remember it right now. So fucking hot.
When are we allowed to go home?
We have cars at five. Greg. I am having the time of my life.
Are you ready for your bachelorette party? They were out of marine uniforms so I’ve come dressed as a political consultant. Relax. This isn’t real.
Can I stay? But – with you – just as a human dog at the foot of the bed?
I’ll be your dog.
Hey, brother. I’m looking for this girl but I think she might be hiding from me.
Connor. Not right now.
Is there another room, you know, for humping? Because I’ve also lost Roman.
Forget Roman.
Yeah? Cos he was asking about the Dog Pound and he got kinda riled up.
Uuh. He’s still talking about that? Pathetic. He enjoyed it, right?
Sure. I mean, so did you. You’d give him a real good whack on the snout. With the Sunday magazine.
Well, rough house.
You know, Dad’s theory was. You got two fighting dogs. You send the weak one away. You punish the weaker one. Then everyone knows the hierarchy and everyone’s happy. So away he went. Hey. So, can I ask? Where were you on 9/11?
Hey, listen, Sandy. I appreciate your offer, I’m not getting out.
Okay. Well if you think you’re going to tell your father, get back in with him, I have—
Keep your money, bring me in. We do this properly.
Uh-huh?
Takeover. Leveraged buy-out.
A dual stock situation. That’s not going to be straightforward.
Price in the toilet, shareholders are pissed. You and me could force him to the table.
What about the rest of the family?
Fuck the rest of the family.
Easy to say?
No one has a clue but me. I can see it all. We take it apart. Fuck local TV, newspapers, parks. We bulldoze the whole fucking shanty town. I just keep the juiciest morsels. Turn the thing from a pod of rotting whales into one bastard great white.
What’s your end?
CEO.
Don’t hold back.
I’m the only one who knows the architecture. The – emotional and corporate architecture.
Well I could like it. Stewy might not like it?
Fuck Stewy. He’ll follow the money like a dog in a cartoon.
And you’re sure you’ve got the stomach?
Yeah. I’m good.
Tom …?
Sorry to wake you.
Is everything okay?
He couldn’t catch his breath. We’ve taken advice. We’re sorry but we think it might not be a good idea for him to come to the wedding.
Uh-huh. I think that’s sensible.
Shiv. He really is sorry.
Me too.
Are you okay?
I’m great. Two less wedding dinners for the caterers. I don’t know Nate. I don’t fucking know.
—and I’d be the pointman on this, you wouldn’t even have to deal direct with my dad. So if we can find a price— But there’s potential?
It could work.
I’m excited. This is pure upside, for both of us. —
Let’s jerk him around for a bit then throw him back. This fucking family.
Bro. How it’s going? What? Oh. Are you psyching me out, bro? Ooh. I’m terrified. Asshole.
If the car doesn’t come soon I’m just going to swim home.
Greg tells me you swallowed your own load.
Yeah. It was – it was pretty wild. It’s cool because it’s kind of like I didn’t cheat? Because all the sperm stayed in my body? Like a closed-loop system. Be really nice to see Shiv.
Hey Willa, I just wanted to say – I love you. I love you so much.
What’s happening?
We have cars arriving in five.
Congratulations. I hear you swallowed your own load.
I did.
It’s been a really wonderful night.
I wanted to apologize.
Oh. This is new.
I shouldn’t have brought you into it.
You know what? I don’t care if you use my name— but the truth is, you don’t need to. He’s scared of us.
Got it.
Gil? Well, this is socially uncomfortable. Hey … Yeah …? What just now …? So what did she say …? Okay, interesting …
Hey, Shiv? I’m home! And I still have both my eyebrows!
Oh. You’re back already? I was just—
God honey, I’ve missed you—
How was it?
Which? Oh. The party? Yeah it was a – blast.
So what happened?
You know. This and that. The usual. Normal stuff.
Specifically what, Tom?
Wait. Shiv? Because I thought you said—
I’m shitting you, Tom. It’s good to have you back.
Hey, listen I had an idea – what do you think about this? As you know since I read that thing, I’m a feminist. Well why don’t I take your name instead of you taking mine? Tom and Shiv Roy? What do you think?
So, Tom? Listen, you know the toxic thing that you know about that I told you I didn’t want to know about?
Oh yeah?
I think, one way and another, I’m ready to know about it now.
? Those girls from the art thing …? I want you to put the word around – they’re junkies, they’re flakes, they’re shooting seed capital straight into their arms. Let’s sink them.
Okay. Here they are! Will that make it through?
I don’t think they will make it through, will they?
Well don’t ask me. You’re the wedding planner, Charlotte – is this part of the plan? Hey! Hey!!
Come on. Come on down! This is not the welcome I intended.
We’ll sort it out, Tom. If you wait here we’ll buggy or car you to the accommodation!
Hey hey hey! How the fuck long is that going to take?
Not long. I can round up some buggies.
I work in hospitality, Charlotte, and I can smell the bullshit. I’m going to remain calm but this is a major issue right here. Huge! Dad! Hey hey hey! Mom? You okay?
Absolutely, Tom! Wonderful.
Good ride? You like it?
Fantastic. Couple of hours at the airfield, waiting for the gang, but yes. Yes. Great to be here.
Couple of hours?
It was wonderful just sitting there. We liked watching the planes. Your father thought he might have seen the man from U2?
And Arthur Laffer. You know, of the Laffer curve? Are they coming?
Uh-huh, sounds right, it’s mostly rock gods and economists! Hey hey it’s the Fly Guys!
Your mother is a little thirsty is the only thing?
I don’t want to be a bother, Tom. It’s my fault.
Oh, Mom. Say, you should say. I hope you’re pleased, Charlotte, my mother’s dying of thirst. And I’m picking up a case. I am carrying a case on My Wedding Eve.
Listen, I’m going to have to go. I’ll see you there, you’ve got the change from Sarah about the time for the embassy— Sorry, are we okay?
Yup.
You don’t have to come down to the wedding, Gil, if you’re busy?
We’ve just been doing the media monitoring?
Motherfucker! I’ll fucking kill him. I’ll take them to pieces.
He’s not sleeping. It was what’s-his-name Screwdriverface. He’s got under his skin.
The – the – the bit—
The bit that implied he murdered his wife. Yeah, for some reason that has ‘somewhat irked him’?
Gil, let us hit that, you need to—
I know. I know, I’m focussed. I’m focussed. I’m X-raying this briefing for salient facts. I mean I don’t want to get this out of proportion but – is it possible your father is the worst human being who has ever lived?
I really don’t think it’s good to focus on—
Is it true he’s not coming to the wedding out of – spite?
Well – it’s complicated—
I want to take him out. I want to destroy ATN.
I’m not sure that’s wise.
And if I said it was wise. Would you have a problem with that?
In the end, I’ll do whatever you want, Gil.
My son. Probably intrigued to hear whether his father might have murdered his mother?
He’ll calm down.
If there’s something – anything you can get, Shiv, I’m in a fucking knife fight holding a dildo made of American cheese.
Your sister knows about Lake Como, right? She knows Venice exists and Cape Town and the Maldives? She is aware of these locations?
How we doing?
But she just what – she’s got a thing for fallen empires?
I got the call. You get the call?
We’re putting together a hostile takeover of one of the largest media corporations in the world. I   it might be worth braving some non- vintage champagne to keep it discreet?
I got the call. Canadians are in. A bottle of champagne please.
So what ten days and we go in for the kill? We can’t keep it on lockdown for more than about ten days, right?
John. Have we got any champagne?
So like the seventeenth for the bear hug? Ten days till the end of the world. Good?
There’s just one little thing. The Canadians? There’s just a little static about some details.
Like what?
Like – you as CEO, just, some queries. But I think it’s good.
We’ve not got champagne. I can do a white wine spritzer?
Relax. This doesn’t work without you. It’s normal co-investor shit. It’s just positioning? I’ll deal. Probably looking for a board seat.
If you tried to fuck me, I’d kill you.
Good, and if you tried to fuck me I’d kill you too, that’s why we’re such good friends.
Frank knows the Canadians, you want me to …?
I’ll handle, okay? No leaks. Why you so jumpy about this, Ken?
Why am I jumpy? About screwing Rome, screwing Shiv and Connor? Probably – blowing what’s left of my dad’s fucking brain? About taking the company out of family control, forever? I don’t know, Stewy, why would that make me jumpy?
Look, I don’t give a fuck.
But I mean, do you want me to ask?
I’m just curious if she’s going to come begging.
Okay. Because I can ask?
I don’t want to ask. If she wants to ask she can ask.
Because I can physically see her?
Do   ask, Gerri, okay? If she comes crawling, then I’ll think about coming. What’s going on? Have you seen Caroline? Is she still with that chinless hippy prick?
I don’t know. Everyone’s just arriving. The castle is currently being invaded.
I thought we might miss the rehearsal!
We don’t need to rehearse, we’re gonna kill it.
And have you thought again about your dad and if maybe we want to reconsider and—?
Fuck him.
Right. Right. And whether we want to go Wambsgans? Roy- Wambsgans or, as I’ve said, I would be willing to drop traditional and go Roy myself – in fact—
Look, I know this is kind of weird timing, but there’s something I need to ask … to clear up.
Uh-huh?
I could do with knowing about the bad thing, in cruises, you know the thing that meant you couldn’t sleep?",0.39298721080395715,0.5910671495401593,0.2524678457750758,0.3395518881612833,0.2677736337168087,0.32883247001958427,0.30786940109318317,0.25490065089274033,0.44099823696844614,0.33238278034685265,0.1693319302198213,0.0762519695830389,0.186385712739247,0.4863433625979988,0.4334152230528989,0.2153374531737237,0.2413996860559564,0.2828125362145478,0.1557943531458219
